"title", price, url
"Levis X Outerknown Wellthread lined Mens Trucker Denim Jacket Size Medium NWT", $87.99, https://www.ebay.com/itm/Levis-X-Outerknown-Wellthread-lined-Mens-Trucker-Denim-Jacket-Size-Medium-NWT/164180553667?epid=19036307276&hash=item2639ec6fc3:g:Gs8AAOSwqOxehPDo
"Outerknown "S.E.A." Shirt Size M Organic Cotton Long Sleeve Button NEW", $33.00, https://www.ebay.com/itm/Outerknown-S-E-A-Shirt-Size-M-Organic-Cotton-Long-Sleeve-Button-NEW/303564186840?hash=item46add5e4d8:g:FMoAAOSwxzleilQt
"Outerknown Mens Verano Beach Pants Black XL New", $39.99, https://www.ebay.com/itm/Outerknown-Mens-Verano-Beach-Pants-Black-XL-New/233411758137?hash=item36586cc839:g:DOYAAOSwl2dd2E9Z
"outerknown Mens Pants Black Size Small", $39.99, https://www.ebay.com/itm/outerknown-Mens-Pants-Black-Size-Small/274213218732?hash=item3fd861a9ac:g:WfUAAOSw-LJeI-L2
"OUTERKNOWN Men's Short Sleeve Henley Shirt Beige Organic Cotton Hemp Size Small", $49.99, https://www.ebay.com/itm/OUTERKNOWN-Mens-Short-Sleeve-Henley-Shirt-Beige-Organic-Cotton-Hemp-Size-Small/274297187299?hash=item3fdd62ebe3:g:u90AAOSwL-Fdve3Y
"Outerknown Blanket Shirt Size Medium Kelly Slater Brand Sustainable Clothing NEW", $69.99, https://www.ebay.com/itm/Outerknown-Blanket-Shirt-Size-Medium-Kelly-Slater-Brand-Sustainable-Clothing-NEW/333580356737?hash=item4daaf04c81:g:H1MAAOSw8CBenZia
"Outerknown Sunday Sweater Pant Jogger - Indigo - Large - Worn 1 time only -GREAT", $21.99, https://www.ebay.com/itm/Outerknown-Sunday-Sweater-Pant-Jogger-Indigo-Large-Worn-1-time-only-GREAT/202987227212?hash=item2f42fb484c:g:vKsAAOSwaPhenGMZ
"Outerknown - Men's green ECONYL swim trunk - Size 32", $38.38, https://www.ebay.com/itm/Outerknown-Mens-green-ECONYL-swim-trunk-Size-32/274092624658?hash=item3fd1318b12:g:BswAAOSwk8JdyfhC
"Levis Outerknown Sherpa Jacket Gray L", $85.00, https://www.ebay.com/itm/Levis-Outerknown-Sherpa-Jacket-Gray-L/174186262914?hash=item288e4f7182:g:2xMAAOSwAMVeQC4t
"Levi's 511 WellThread X Outerknown Slim Fit Men's Jeans 045112927", $54.98, https://www.ebay.com/itm/Levis-511-WellThread-X-Outerknown-Slim-Fit-Mens-Jeans-045112927/372898166898?hash=item56d2767872:g:pbcAAOSwvmteDGgk
"Outerknown "S.E.A." Shirt Size M Organic Cotton Short Sleeve Button NEW", $24.99, https://www.ebay.com/itm/Outerknown-S-E-A-Shirt-Size-M-Organic-Cotton-Short-Sleeve-Button-NEW/303558421884?hash=item46ad7ded7c:g:BkIAAOSwIuNeilzg
"$78 Outerknown Paz Slim Fit Organic Cotton Twill Chino Mens Shorts Sz. M", $34.99, https://www.ebay.com/itm/78-Outerknown-Paz-Slim-Fit-Organic-Cotton-Twill-Chino-Mens-Shorts-Sz-M/264718634237?hash=item3da275ccfd:g:w~4AAOSwkMNerZBg
"New Outerknown Men's Revolution Trunks Floral Board Shorts Size 29 Unlined", $22.95, https://www.ebay.com/itm/New-Outerknown-Mens-Revolution-Trunks-Floral-Board-Shorts-Size-29-Unlined/202823338958?hash=item2f39368bce:g:wV4AAOSwWz1dzu5C
"OUTERKNOWN EVOLUTION POCKET SCALLOP SHORTS", $18.00, https://www.ebay.com/itm/OUTERKNOWN-EVOLUTION-POCKET-SCALLOP-SHORTS/193447598317?hash=item2d0a6018ed:g:I2gAAOSwsXNerZs6
"NWT Levis x Outerknown Western Long Sleeve Button Linen Shirt Men’s Beige", $49.95, https://www.ebay.com/itm/NWT-Levis-x-Outerknown-Western-Long-Sleeve-Button-Linen-Shirt-Men-s-Beige/333475355052?hash=item4da4ae19ac:g:sUsAAOSws5FeGSYz
"NEW! OUTERKNOWN "S.E.A." Short Sleeve Men's Button Shirt Organic Cotton Sz XXL", $19.99, https://www.ebay.com/itm/NEW-OUTERKNOWN-S-E-A-Short-Sleeve-Mens-Button-Shirt-Organic-Cotton-Sz-XXL/223993559459?hash=item34270e79a3:g:Y8oAAOSwaktelk~g
"Outerknown by Kelly Slater Drop Crotch Joggers Sz XL, $98, Recycled Cotton!!", $16.50, https://www.ebay.com/itm/Outerknown-by-Kelly-Slater-Drop-Crotch-Joggers-Sz-XL-98-Recycled-Cotton/353062195606?hash=item5234259196:g:WDAAAOSw339epZzB
"Outerknown Men's Nylon Shorts-Size 34-Teal Blue", $30.00, https://www.ebay.com/itm/Outerknown-Mens-Nylon-Shorts-Size-34-Teal-Blue/184201157190?hash=item2ae33e9a46:g:hBoAAOSwJp1epYrp
"Mens Outerknown Shorts", $27.00, https://www.ebay.com/itm/Mens-Outerknown-Shorts/383529697945?hash=item594c26c299:g:wO8AAOSwKAJekejb
"OUTERKNOWN Nomadic Polo Men’s Shirt XL Olive", $17.97, https://www.ebay.com/itm/OUTERKNOWN-Nomadic-Polo-Men-s-Shirt-XL-Olive/184178840824?hash=item2ae1ea14f8:g:efkAAOSwDCBeC5UE
"Outerknown - Men’s Terrycloth Lounge Shorts - Med., Sage", $25.00, https://www.ebay.com/itm/Outerknown-Men-s-Terrycloth-Lounge-Shorts-Med-Sage/184271356375?hash=item2ae76dc1d7:g:sJsAAOSwp0ZejNUA
"OUTERKNOWN Dark Blue Tan Pocket Evolution Trunk Tribal Pattern Swim Shorts - 33", $39.99, https://www.ebay.com/itm/OUTERKNOWN-Dark-Blue-Tan-Pocket-Evolution-Trunk-Tribal-Pattern-Swim-Shorts-33/293207363112?hash=item4444854e28:g:jVkAAOSw6FBdZxrN
"Levi's 511 WellThread X Outerknown dark wash 32x32 Slim Fit Men's Jeans", $32.00, https://www.ebay.com/itm/Levis-511-WellThread-X-Outerknown-dark-wash-32x32-Slim-Fit-Mens-Jeans/143547687844?hash=item216c1be3a4:g:~QUAAOSw-exeYFrs
"Outerknown Ocotillo Shirt Size M Organic Cotton Long Sleeve Button NEW", $24.99, https://www.ebay.com/itm/Outerknown-Ocotillo-Shirt-Size-M-Organic-Cotton-Long-Sleeve-Button-NEW/303552648063?hash=item46ad25d37f:g:ttIAAOSwY2peilwv
"Nwot Outerknown Vagabond Cargo Pants Mens Size 33/30", $78.00, https://www.ebay.com/itm/Nwot-Outerknown-Vagabond-Cargo-Pants-Mens-Size-33-30/153910431833?hash=item23d5c6d059:g:Vv0AAOSw6bVc71NW
"Outerknown Apex Trunk Boardshort 36 NWOT", $23.49, https://www.ebay.com/itm/Outerknown-Apex-Trunk-Boardshort-36-NWOT/193441080394?hash=item2d09fca44a:g:8AUAAOSw~t5ep4uJ
"Outerknown Transitional Flannel Medium", $11.50, https://www.ebay.com/itm/Outerknown-Transitional-Flannel-Medium/193439385841?hash=item2d09e2c8f1:g:I5IAAOSw-r5epeqN
"Outerknown Only Gun You Need Tee Shirt Medium", $14.26, https://www.ebay.com/itm/Outerknown-Only-Gun-You-Need-Tee-Shirt-Medium/193439381113?hash=item2d09e2b679:g:lvYAAOSwCzJepeii
"Men's Fleece Jacket. Outerknown. Gray, w/Black shoulders. Full Zip. Size Large", $50.00, https://www.ebay.com/itm/Mens-Fleece-Jacket-Outerknown-Gray-w-Black-shoulders-Full-Zip-Size-Large/164183376205?hash=item263a17814d:g:fE4AAOSwIYJeQKbg
"Outerknown Apex Trunk Boardshort 32", $43.00, https://www.ebay.com/itm/Outerknown-Apex-Trunk-Boardshort-32/193439112609?hash=item2d09de9da1:g:P-AAAOSw2eNepaOA
"Outerknown XL Beach Shirt Cabana Blue", $32.00 $70.00, https://www.ebay.com/itm/Outerknown-XL-Beach-Shirt-Cabana-Blue/223989005285?hash=item3426c8fbe5:g:0~MAAOSwcLlemxuY
"Mens Outerknown S.E.A Drifter Tapered Fit Jeans Size 31 x 31", $45.00, https://www.ebay.com/itm/Mens-Outerknown-S-E-A-Drifter-Tapered-Fit-Jeans-Size-31-x-31/143560808042?hash=item216ce4166a:g:pvgAAOSwRVRedZz1
"OUTERKNOWN Men's Short Sleeve Crew Tee Shirt Chest Pocket Yellow Striped Size M", $34.99, https://www.ebay.com/itm/OUTERKNOWN-Mens-Short-Sleeve-Crew-Tee-Shirt-Chest-Pocket-Yellow-Striped-Size-M/274320173185?hash=item3fdec1a881:g:fsUAAOSw4ohcOpGo
"Outerknown Mens size 33 Evolution Pocket Scallop Surf Trunk Board Walk short", $24.99, https://www.ebay.com/itm/Outerknown-Mens-size-33-Evolution-Pocket-Scallop-Surf-Trunk-Board-Walk-short/313062885439?hash=item48e400883f:g:76YAAOSw8mdeorXD
"Outerknown Baja Hoodie Pullover Jacket Shirt XL NEW $225 Sold Out", $74.00 $160.00, https://www.ebay.com/itm/Outerknown-Baja-Hoodie-Pullover-Jacket-Shirt-XL-NEW-225-Sold-Out/223986955321?hash=item3426a9b439:g:f9UAAOSw7ohemHYX
"Outerknown Adios Packable Jacket - Mens Size Medium", $60.00, https://www.ebay.com/itm/Outerknown-Adios-Packable-Jacket-Mens-Size-Medium/324121279361?hash=item4b77223b81:g:KyMAAOSw6VVeg4w4
"Outerknown Mens Hoodie Blue Long Sleeve Full Zip Sweater Top Size XL New", $55.25, https://www.ebay.com/itm/Outerknown-Mens-Hoodie-Blue-Long-Sleeve-Full-Zip-Sweater-Top-Size-XL-New/274341720202?hash=item3fe00a708a:g:qTMAAOSwpGpekK1O
"Outerknown OK Knit Tee XL Kelly Slater Surf T-shirt Cotton / Recycled Polyester", $23.00, https://www.ebay.com/itm/Outerknown-OK-Knit-Tee-XL-Kelly-Slater-Surf-T-shirt-Cotton-Recycled-Polyester/283783549402?hash=item4212d151da:g:w1gAAOSw~8leR6ic
"Outerknown S.E.A Legs Navy Slim (Size 30x32)", $50.00, https://www.ebay.com/itm/Outerknown-S-E-A-Legs-Navy-Slim-Size-30x32/124165944984?hash=item1ce8ddf698:g:bcMAAOSwPjNemr~Q
"Outerknown S.E.A Legs Grey Slim (Size 30x32)", $50.00, https://www.ebay.com/itm/Outerknown-S-E-A-Legs-Grey-Slim-Size-30x32/124165945641?hash=item1ce8ddf929:g:uVMAAOSwnhFemsQr
"Outerknown Pale Yellow Tomorrow Today Tee Men's Size XXL", $9.99, https://www.ebay.com/itm/Outerknown-Pale-Yellow-Tomorrow-Today-Tee-Mens-Size-XXL/303212705761?hash=item4698e2b7e1:g:CgoAAOSwNrNdFGGP
"OUTERKNOWN TRANSITIONAL FLANNEL Size Medium", $26.00, https://www.ebay.com/itm/OUTERKNOWN-TRANSITIONAL-FLANNEL-Size-Medium/193438092904?hash=item2d09cf0e68:g:6E8AAOSw92RepIpB
"OUTERKNOWN S.E.A. Pocket tee shirt men's new XL Heather Grey", $14.97, https://www.ebay.com/itm/OUTERKNOWN-S-E-A-Pocket-tee-shirt-mens-new-XL-Heather-Grey/184113950421?hash=item2ade0beed5:g:uxUAAOSwQTVeEO9u
"Outerknown by Kelly Slater Mens Tan Paz Pants, Size XL, $98, Recycled Cotton!!", $10.50, https://www.ebay.com/itm/Outerknown-by-Kelly-Slater-Mens-Tan-Paz-Pants-Size-XL-98-Recycled-Cotton/133390020405?hash=item1f0eaa2f35:g:fzMAAOSw2uhemxbg
"Levis X Outerknown Wellthread lined Mens Trucker Denim Jacket Size Medium NWT", $93.49, https://www.ebay.com/itm/Levis-X-Outerknown-Wellthread-lined-Mens-Trucker-Denim-Jacket-Size-Medium-NWT/164146555188?epid=19036307276&hash=item2637e5a934:g:Gs8AAOSwqOxehPDo
"NEW Levi's x OUTERKNOWN Wellthread Linen Blend Western Shirt Men's XXL", $49.99, https://www.ebay.com/itm/NEW-Levis-x-OUTERKNOWN-Wellthread-Linen-Blend-Western-Shirt-Mens-XXL/264527031762?hash=item3d970a2dd2:g:uLQAAOSwRiJdxndF
"Outerknown Ocotillo Shirt Size M Organic Cotton Long Sleeve Button NEW", $25.88, https://www.ebay.com/itm/Outerknown-Ocotillo-Shirt-Size-M-Organic-Cotton-Long-Sleeve-Button-NEW/303545154348?hash=item46acb37b2c:g:ttIAAOSwY2peilwv
"Levi’s Outerknown Men's Long Sleeve Shirt Size Large Cotton", $23.30, https://www.ebay.com/itm/Levi-s-Outerknown-Mens-Long-Sleeve-Shirt-Size-Large-Cotton/362971802538?hash=item5482ce2baa:g:GcoAAOSwjmhel8YI
"Outerknown Lost Coast Moleskin Shirt M Winter Sky Color", $15.50, https://www.ebay.com/itm/Outerknown-Lost-Coast-Moleskin-Shirt-M-Winter-Sky-Color/193429158053?hash=item2d0946b8a5:g:cHAAAOSwby1em3bc
"Outerknown Quilted Evolution Shirt Jacket", $28.00, https://www.ebay.com/itm/Outerknown-Quilted-Evolution-Shirt-Jacket/193429140351?hash=item2d0946737f:g:DyYAAOSwGIZem3Nt
"Outerknown shirt - Men's Medium (M)", $28.00, https://www.ebay.com/itm/Outerknown-shirt-Mens-Medium-M/193428836920?hash=item2d0941d238:g:hxAAAOSwRS1ef2PC
"OUTERKNOWN Men's XL Blue Chambray Long Sleeve Collared Shirt Hemp Cotton Blend", $27.98, https://www.ebay.com/itm/OUTERKNOWN-Mens-XL-Blue-Chambray-Long-Sleeve-Collared-Shirt-Hemp-Cotton-Blend/202974247831?hash=item2f42353b97:g:uGAAAOSwja5eoRhB
"MEN'S OUTERKNOWN BLUE & WHITE STRIPE SHORT SLEEVE SHIRT SZ LARGE", $15.00, https://www.ebay.com/itm/MENS-OUTERKNOWN-BLUE-WHITE-STRIPE-SHORT-SLEEVE-SHIRT-SZ-LARGE/233502441522?hash=item365dd48032:g:P20AAOSwYPpeUD0T
"NWT Outerknown Highland Blanket Shirt Jacket Size Medium Blue/Grey Wool Blend", $44.99, https://www.ebay.com/itm/NWT-Outerknown-Highland-Blanket-Shirt-Jacket-Size-Medium-Blue-Grey-Wool-Blend/303545133957?hash=item46acb32b85:g:4xcAAOSw0NZeilLQ
"outerknown henley mens small", $25.00, https://www.ebay.com/itm/outerknown-henley-mens-small/124157472121?hash=item1ce85cad79:g:A54AAOSwDFFek3Gg
"Outerknown Outbound Jacket Medium Black Harrington/Moto", $85.00, https://www.ebay.com/itm/Outerknown-Outbound-Jacket-Medium-Black-Harrington-Moto/303541331035?hash=item46ac79245b:g:VRwAAOSwGFVee3Jr
"Outerknown x Levis Sherpa Lined Trucker Jacket - Large, NWOT", $80.00 $120.00, https://www.ebay.com/itm/Outerknown-x-Levis-Sherpa-Lined-Trucker-Jacket-Large-NWOT/373021371633?hash=item56d9ce6cf1:g:HwYAAOSwyIlelk-P
"Levis X OUTERKNOWN WellThread Mens Sherpa Trucker Jacket Mineral Grey NWOT Size", $21.60, https://www.ebay.com/itm/Levis-X-OUTERKNOWN-WellThread-Mens-Sherpa-Trucker-Jacket-Mineral-Grey-NWOT-Size/184256088961?hash=item2ae684cb81:g:1g4AAOSwoLFemKK9
"Outerknown Men's M Essential Button Down Shirt Charcoal Gray", $39.99, https://www.ebay.com/itm/Outerknown-Mens-M-Essential-Button-Down-Shirt-Charcoal-Gray/233564892588?hash=item36618d6dac:g:DkEAAOSw3AdenQC3
"Outerknown S/S Oxford Shirt - Kelly Slater Brand Mens L/M", $16.99, https://www.ebay.com/itm/Outerknown-S-S-Oxford-Shirt-Kelly-Slater-Brand-Mens-L-M/324133360261?hash=item4b77da9285:g:flcAAOSwtPNekoGd
"OUTERKNOWN Mens Paz Pants Size Medium Black Stretch Tie Waist Slim", $25.00, https://www.ebay.com/itm/OUTERKNOWN-Mens-Paz-Pants-Size-Medium-Black-Stretch-Tie-Waist-Slim/153902544449?hash=item23d54e7641:g:bK8AAOSwVJFeMmP-
"Outerknown Men Chino Shorts Organic Cotton Hemp Elastic Waist Pocket Gray Medium", $47.99, https://www.ebay.com/itm/Outerknown-Men-Chino-Shorts-Organic-Cotton-Hemp-Elastic-Waist-Pocket-Gray-Medium/392736757238?hash=item5b70ef55f6:g:gxAAAOSwoSxeePrW
"Outerknown Mens Paz Relaxed Taper Fit Pants Shadow Grey XL New", $34.99, https://www.ebay.com/itm/Outerknown-Mens-Paz-Relaxed-Taper-Fit-Pants-Shadow-Grey-XL-New/362910961977?hash=item547f2dd139:g:eCgAAOSwyGpd582T
"Outerknown Mens Sweater Small", $45.00, https://www.ebay.com/itm/Outerknown-Mens-Sweater-Small/124150560417?hash=item1ce7f336a1:g:rPUAAOSw6BpeiRO0
"NWT OUTERKNOWN Levis 502 Denim Jeans Men Size 36 x 32 MSRP $128.00", $23.97, https://www.ebay.com/itm/NWT-OUTERKNOWN-Levis-502-Denim-Jeans-Men-Size-36-x-32-MSRP-128-00/184105136541?hash=item2add85719d:g:QC4AAOSwdvxeCZQD
"Levis Men's Outerknown Wellthread Lined Trucker Denim Jean Jacket Blue Size XXL", $78.49, https://www.ebay.com/itm/Levis-Mens-Outerknown-Wellthread-Lined-Trucker-Denim-Jean-Jacket-Blue-Size-XXL/124126792406?hash=item1ce6888ad6:g:7xMAAOSwQZFeEpd2
"Outerknown by Kelly Slater Mens Grey Paz Pants, Size XL, $98, Recycled Hemp!!", $10.50, https://www.ebay.com/itm/Outerknown-by-Kelly-Slater-Mens-Grey-Paz-Pants-Size-XL-98-Recycled-Hemp/133379398222?hash=item1f0e081a4e:g:YPAAAOSwIuNedjr~
"Levis X Outerknown Mens Sherpa Trucker Jacket Mineral Grey Well Thread NEW SizeM", $175.00, https://www.ebay.com/itm/Levis-X-Outerknown-Mens-Sherpa-Trucker-Jacket-Mineral-Grey-Well-Thread-NEW-SizeM/153356295306?hash=item23b4bf5c8a:g:jiwAAOSwGWJcT60X
"Outerknown Blanket Shirt package (Two Shirts)", $99.00, https://www.ebay.com/itm/Outerknown-Blanket-Shirt-package-Two-Shirts/114185749811?hash=item1a96004533:g:F3AAAOSwS3delOqM
"OUTERKNOWN H2OK Long Sleeve 30 UPF Men’s Tee Shirt L Black", $14.97, https://www.ebay.com/itm/OUTERKNOWN-H2OK-Long-Sleeve-30-UPF-Men-s-Tee-Shirt-L-Black/184104861772?hash=item2add81404c:g:BAYAAOSwWkdeCU-c
"Levis Outerknown Western Blue Overdyed Button Front Shirt Men’s Size Large", $29.00, https://www.ebay.com/itm/Levis-Outerknown-Western-Blue-Overdyed-Button-Front-Shirt-Men-s-Size-Large/303503055314?hash=item46aa3119d2:g:PT4AAOSwdAleWz4D
"Outerknown "S.E.A." Shirt Size M Organic Cotton Long Sleeve Button NEW", $34.99, https://www.ebay.com/itm/Outerknown-S-E-A-Shirt-Size-M-Organic-Cotton-Long-Sleeve-Button-NEW/303532721240?hash=item46abf5c458:g:ouAAAOSw0Xheilfh
"Levis Mens 511 Wellthread X Outerknown Dark Denim Jeans Tag Size 34X36", $82.85, https://www.ebay.com/itm/Levis-Mens-511-Wellthread-X-Outerknown-Dark-Denim-Jeans-Tag-Size-34X36/174222513746?hash=item2890789652:g:vTYAAOSwTNBdl27h
"New Levi's x OUTERKNOWN Wellthread Western Shirt Mens Size XL Tan 215490010", $58.49, https://www.ebay.com/itm/New-Levis-x-OUTERKNOWN-Wellthread-Western-Shirt-Mens-Size-XL-Tan-215490010/113897627420?hash=item1a84d3df1c:g:elQAAOSwVildhr9~
"NWT Levis x Outerknown Western L/S Button Front Shirt Men’s Size Medium", $44.99, https://www.ebay.com/itm/NWT-Levis-x-Outerknown-Western-L-S-Button-Front-Shirt-Men-s-Size-Medium/293365269377?hash=item444deec381:g:evsAAOSwj-5d5X1C
"Outerknown Mens Hoodie Blue Long Sleeve Full Zip Sweater Top Size XL New", $55.25, https://www.ebay.com/itm/Outerknown-Mens-Hoodie-Blue-Long-Sleeve-Full-Zip-Sweater-Top-Size-XL-New/274332984683?hash=item3fdf85256b:g:qTMAAOSwpGpekK1O
"OUTERKNOWN S.E.A. Pocket tee shirt men's new L", $11.97, https://www.ebay.com/itm/OUTERKNOWN-S-E-A-Pocket-tee-shirt-mens-new-L/184108265649?hash=item2addb530b1:g:mcUAAOSwXq5eDUM1
"outerknown medium Men’s Sweatshirt Black", $45.00, https://www.ebay.com/itm/outerknown-medium-Men-s-Sweatshirt-Black/153840829372?hash=item23d1a0c3bc:g:ArsAAOSwiaJeUFUT
"Outerknown x Levi's Wellthread Sherpa Lined Trucker - Medium", $33.01, https://www.ebay.com/itm/Outerknown-x-Levis-Wellthread-Sherpa-Lined-Trucker-Medium/254558293037?hash=item3b44db4c2d:g:FnEAAOSwPlFehefV
"NWT Outerknown Blanket Shirt Size Medium Kelly Slater Brand Sustainable Clothing", $79.00, https://www.ebay.com/itm/NWT-Outerknown-Blanket-Shirt-Size-Medium-Kelly-Slater-Brand-Sustainable-Clothing/133382659160?hash=item1f0e39dc58:g:h6AAAOSwKKBeU15y
"NWT Outerknown Blanket Shirt Size Medium Kelly Slater Brand Sustainable Clothing", $75.00, https://www.ebay.com/itm/NWT-Outerknown-Blanket-Shirt-Size-Medium-Kelly-Slater-Brand-Sustainable-Clothing/133382658432?hash=item1f0e39d980:g:SysAAOSwsjVeU14O
"Outerknown Navy Blue Short Sleeve Oxford Shirt Size Large", $35.00, https://www.ebay.com/itm/Outerknown-Navy-Blue-Short-Sleeve-Oxford-Shirt-Size-Large/264688645973?hash=item3da0ac3755:g:SkEAAOSwiFBeh2zK
"MEN'S OUTERKNOWN GRAY SURFBOARD GRAPHIC SHORT SLEEVE T-SHIRT SZ M", $17.40, https://www.ebay.com/itm/MENS-OUTERKNOWN-GRAY-SURFBOARD-GRAPHIC-SHORT-SLEEVE-T-SHIRT-SZ-M/233502437558?hash=item365dd470b6:g:7JAAAOSwEy1eUDw-
"Kelly Slater's OUTERKNOWN Organic Cotton Nomadic Polo Men’s Shirt XL Black", $15.00, https://www.ebay.com/itm/Kelly-Slaters-OUTERKNOWN-Organic-Cotton-Nomadic-Polo-Men-s-Shirt-XL-Black/362963108030?hash=item54824980be:g:HgkAAOSw6yBee3Ej
"Outerknown Mens Navy Puffer Jacket Size Large", $33.00, https://www.ebay.com/itm/Outerknown-Mens-Navy-Puffer-Jacket-Size-Large/114164469337?hash=item1a94bb8e59:g:E68AAOSwqUteg4ZR
"Outerknown Men’s S.E.A. Buttondown Organic Shirt Large BNWT", $33.00, https://www.ebay.com/itm/Outerknown-Men-s-S-E-A-Buttondown-Organic-Shirt-Large-BNWT/164145016050?hash=item2637ce2cf2:g:HocAAOSwmj5eg2zw
"Levis Outerknown Wellthread Trucker Jacket LARGE New with tags $185 MSRP", $99.99, https://www.ebay.com/itm/Levis-Outerknown-Wellthread-Trucker-Jacket-LARGE-New-with-tags-185-MSRP/324047423365?hash=item4b72bb4785:g:7uYAAOSwApleJMdD
"OUTERKNOWN Men's S/S T-Shirt TRIPPY - SMK - Medium - NWT LAST ONE LEFT", $33.00, https://www.ebay.com/itm/OUTERKNOWN-Mens-S-S-T-Shirt-TRIPPY-SMK-Medium-NWT-LAST-ONE-LEFT/352988601845?hash=item522fc29df5:g:NUoAAOSw63td7-9H
"Brand New Outerknown Men's Organic Cotton Heavy Twill Long-Sleeve Shirt - Large", $79.37, https://www.ebay.com/itm/Brand-New-Outerknown-Mens-Organic-Cotton-Heavy-Twill-Long-Sleeve-Shirt-Large/283751740723?hash=item4210ebf533:g:8QwAAOSw6INeJr3t
"OUTERKNOWN Organic Cotton Button Down Short Sleeve", $35.00, https://www.ebay.com/itm/OUTERKNOWN-Organic-Cotton-Button-Down-Short-Sleeve/124035194674?hash=item1ce112df32:g:8eoAAOSwhQpeEnhE
"NWT OUTERKNOWN Men's S.E.A Tee XL Light Blue Short Sleeve Crew Neck Shirt Sea", $18.00, https://www.ebay.com/itm/NWT-OUTERKNOWN-Mens-S-E-A-Tee-XL-Light-Blue-Short-Sleeve-Crew-Neck-Shirt-Sea/184162022786?hash=item2ae0e97582:g:Ee0AAOSwc7teObvU
"Men’s Outerknown Transitional Flannel Organic Cotton Shirt XL Black", $25.00, https://www.ebay.com/itm/Men-s-Outerknown-Transitional-Flannel-Organic-Cotton-Shirt-XL-Black/362954937837?hash=item5481ccd5ed:g:IGQAAOSwAD5ee3OK
"Outerknown terry pocket crewneck", $39.00, https://www.ebay.com/itm/Outerknown-terry-pocket-crewneck/133372444486?hash=item1f0d9dff46:g:pS4AAOSwqR5eSK15
"Levis X Outerknown Wellthread lined Mens Trucker Denim Jacket Size Small NWT", $98.99, https://www.ebay.com/itm/Levis-X-Outerknown-Wellthread-lined-Mens-Trucker-Denim-Jacket-Size-Small-NWT/164146579207?epid=12037666511&hash=item2637e60707:g:kFAAAOSwKpdehPE8
"Levis Outerknown Trucker Jean Jacket Wellthread Mens XL", $89.50, https://www.ebay.com/itm/Levis-Outerknown-Trucker-Jean-Jacket-Wellthread-Mens-XL/273793922008?hash=item3fbf63b3d8:g:qecAAOSwe9VcATrP
"RARE Levis Outerknown 511 Slim Dark Wash Poly Cotton Denim Jeans 34x32 NICE!", $29.99, https://www.ebay.com/itm/RARE-Levis-Outerknown-511-Slim-Dark-Wash-Poly-Cotton-Denim-Jeans-34x32-NICE/353024964233?hash=item5231ed7689:g:CyIAAOSwbklefmu6
"Outerknown - Pocket Evolution Trunk - Size: 29 Colour: Blue", $1.80 $16.00, https://www.ebay.com/itm/Outerknown-Pocket-Evolution-Trunk-Size-29-Colour-Blue/164138587604?hash=item26376c15d4:g:fYMAAOSw8FxecnMZ
"Outerknown Men's L Large Army Green Nomadic Oxford Shirt Organic Cotton EUC", $44.99, https://www.ebay.com/itm/Outerknown-Mens-L-Large-Army-Green-Nomadic-Oxford-Shirt-Organic-Cotton-EUC/143528094322?hash=item216af0ea72:g:O0kAAOSwudBdSpHn
"Outerknown "S.E.A." Shirt Size M Organic Cotton Long Sleeve Button Front", $38.00, https://www.ebay.com/itm/Outerknown-S-E-A-Shirt-Size-M-Organic-Cotton-Long-Sleeve-Button-Front/124084275810?hash=item1ce3ffca62:g:ds8AAOSwy2BeR5ja
"Catch Surf by Odysea Surfboards, Palm Tree Tuxedo Shirt NWT, $70 Outerknown, XL", $9.99 $49.99, https://www.ebay.com/itm/Catch-Surf-by-Odysea-Surfboards-Palm-Tree-Tuxedo-Shirt-NWT-70-Outerknown-XL/353012069272?hash=item523128b398:g:AhgAAOSw-89dyqfU
"Outerknown by Kelly Slater Mens Grey Paz Pants, Size XL, $98, Recycled Hemp!!", $9.50, https://www.ebay.com/itm/Outerknown-by-Kelly-Slater-Mens-Grey-Paz-Pants-Size-XL-98-Recycled-Hemp/353015806379?hash=item523161b9ab:g:YPAAAOSwIuNedjr~
"OUTERKNOWN Men’s LARGE jetlag crew neck cotton / alpaca Navy Blue sweater L Peru", $65.25, https://www.ebay.com/itm/OUTERKNOWN-Men-s-LARGE-jetlag-crew-neck-cotton-alpaca-Navy-Blue-sweater-L-Peru/333544947275?hash=item4da8d3fe4b:g:ymUAAOSwZ41ea~3C
"Outerknown Blue Chinos Pants Size 34 Kelly Slater", $8.80, https://www.ebay.com/itm/Outerknown-Blue-Chinos-Pants-Size-34-Kelly-Slater/303525725314?hash=item46ab8b0482:g:V-0AAOSwIlBefrEn
"Outerknown Fisherman Sweater cable knit organic cotton size Medium Kelly Slater", $20.50, https://www.ebay.com/itm/Outerknown-Fisherman-Sweater-cable-knit-organic-cotton-size-Medium-Kelly-Slater/174227037424?hash=item2890bd9cf0:g:ls8AAOSwvXNedpqo
"NWT Outerknown Highland Blanket Shirt Jacket Size Large Plaid Wool Blend", $100.00, https://www.ebay.com/itm/NWT-Outerknown-Highland-Blanket-Shirt-Jacket-Size-Large-Plaid-Wool-Blend/223956339452?hash=item3424d68afc:g:3WcAAOSwp6RedAqS
"OUTERKNOWN Hemp/Organic Cotton Crew Neck Long Sleeved Heavy Knit Top Raw Edge- L", $20.00, https://www.ebay.com/itm/OUTERKNOWN-Hemp-Organic-Cotton-Crew-Neck-Long-Sleeved-Heavy-Knit-Top-Raw-Edge-L/233511423421?hash=item365e5d8dbd:g:ArUAAOSwk9xeXBTo
"Outerknown Men's S.E.A. SHIRT Golden Sun Dot Short Sleeves Top Organic Cotton M", $29.99, https://www.ebay.com/itm/Outerknown-Mens-S-E-A-SHIRT-Golden-Sun-Dot-Short-Sleeves-Top-Organic-Cotton-M/202940305210?hash=item2f402f4f3a:g:omIAAOSwUOJeI4sE
"Outerknown - Ashland Check Camp Shirt. NWT. Size: Medium Colour: MZA", $51.67, https://www.ebay.com/itm/Outerknown-Ashland-Check-Camp-Shirt-NWT-Size-Medium-Colour-MZA/273923951068?hash=item3fc723c9dc:g:gBUAAOSw2GJaia4U
"Levi’s Wellthread X Outerknown Men’s Small Trucker, Limited Edition & Sold Out", $65.00, https://www.ebay.com/itm/Levi-s-Wellthread-X-Outerknown-Men-s-Small-Trucker-Limited-Edition-Sold-Out/254532698049?hash=item3b4354bfc1:g:yFEAAOSwgnteYbuU
"Outerknown Olive Green Chinos Pants Size 34 Kelly Slater", $18.49, https://www.ebay.com/itm/Outerknown-Olive-Green-Chinos-Pants-Size-34-Kelly-Slater/303520542147?hash=item46ab3bedc3:g:-fEAAOSwwmpedmUg
"Outerknown Bathing Suit Size Large L Blue Kelly Slater", $8.50, https://www.ebay.com/itm/Outerknown-Bathing-Suit-Size-Large-L-Blue-Kelly-Slater/303520540513?hash=item46ab3be761:g:mhEAAOSw4E5edmSm
"Levis X Outerknown Wellthread Lined Trucker Denim Jean Jacket Blue Size Small", $77.99, https://www.ebay.com/itm/Levis-X-Outerknown-Wellthread-Lined-Trucker-Denim-Jean-Jacket-Blue-Size-Small/124011360434?hash=item1cdfa730b2:g:5zwAAOSwrvtd9ZR5
"Brand New Levi's Outerknown Wellthread Lined Trucker Denim Jacket Size Small", $65.50, https://www.ebay.com/itm/Brand-New-Levis-Outerknown-Wellthread-Lined-Trucker-Denim-Jacket-Size-Small/383391975321?hash=item5943f14799:g:hWcAAOSwrvteLgyB
"OUTERKNOWN Mens Black T Shirt Short Sleeve NEW Medium", $12.00, https://www.ebay.com/itm/OUTERKNOWN-Mens-Black-T-Shirt-Short-Sleeve-NEW-Medium/153870064820?hash=item23d35edcb4:g:KykAAOSwqFVecuj0
"new Levi's Outerknown men shirt long sleeve 215490010 beige sz S $128", $49.99, https://www.ebay.com/itm/new-Levis-Outerknown-men-shirt-long-sleeve-215490010-beige-sz-S-128/333543088599?hash=item4da8b7a1d7:g:hEUAAOSwLRpeacQn
"Outerknown Mens Paz Relaxed Taper Fit Pants Cobalt XL New", $34.99, https://www.ebay.com/itm/Outerknown-Mens-Paz-Relaxed-Taper-Fit-Pants-Cobalt-XL-New/362838686393?hash=item547adefab9:g:T~kAAOSw3iFd5813
"Outerknown Highland Blanket Shirt Jacket Sz Small Blue Wool Blend Long Sleeve", $38.00, https://www.ebay.com/itm/Outerknown-Highland-Blanket-Shirt-Jacket-Sz-Small-Blue-Wool-Blend-Long-Sleeve/202942334930?hash=item2f404e47d2:g:H~sAAOSwDkledqqh
"Levi’s Wellthread Outerknown Shirt Medium M Western Mens Button Up Green New", $49.00, https://www.ebay.com/itm/Levi-s-Wellthread-Outerknown-Shirt-Medium-M-Western-Mens-Button-Up-Green-New/114153502140?hash=item1a941435bc:g:gi8AAOSwmAheYFT8
"NWOT $100+ Levis Wellthread X Outerknown Linen Blend Western Shirt Sz Small", $39.75, https://www.ebay.com/itm/NWOT-100-Levis-Wellthread-X-Outerknown-Linen-Blend-Western-Shirt-Sz-Small/333530131706?hash=item4da7f1ecfa:g:2w0AAOSw7BBeWWMf
