"title", price, url
"Outerknown Sur Snap Hoodie size Large", $49.00, https://www.ebay.com/itm/Outerknown-Sur-Snap-Hoodie-size-Large/264668133970?hash=item3d9f733a52:g:2r8AAOSwcLlebjrk
"OUTERKNOWN NOMADIC COAST PANT - Size 31 OLIVE, GREEN - Waist 32" Inseam 31"", $34.99, https://www.ebay.com/itm/OUTERKNOWN-NOMADIC-COAST-PANT-Size-31-OLIVE-GREEN-Waist-32-Inseam-31/173622970612?hash=item286cbc48f4:g:G1MAAOSw-nRb3xKb
"Levi’s X Outerknown Men's Long Sleeve Shirt Size Med Cotton Linen Wellthread", $43.00, https://www.ebay.com/itm/Levi-s-X-Outerknown-Mens-Long-Sleeve-Shirt-Size-Med-Cotton-Linen-Wellthread/164070714266?hash=item2633606b9a:g:u~QAAOSwAMVePMlr
"NWT Outerknown S.E.A. Mens DRIFTER Organic Tapered Fit Jeans Mirage 32/30 NEW", $27.60, https://www.ebay.com/itm/NWT-Outerknown-S-E-A-Mens-DRIFTER-Organic-Tapered-Fit-Jeans-Mirage-32-30-NEW/274306880099?hash=item3fddf6d263:g:20sAAOSw9h5ebTF9
"OUTERKNOWN Men's Ditch Hemp & Organic Cotton Denim Pants Blue Sz 30 (actual 32”", $38.00, https://www.ebay.com/itm/OUTERKNOWN-Mens-Ditch-Hemp-Organic-Cotton-Denim-Pants-Blue-Sz-30-actual-32/254511273258?hash=item3b420dd52a:g:FkgAAOSwk5FeHXTE
"Outerknown Grey Soft Chinos 34 S.E.A. Legs Pants Kelly Slater", $5.50, https://www.ebay.com/itm/Outerknown-Grey-Soft-Chinos-34-S-E-A-Legs-Pants-Kelly-Slater/303515493772?hash=item46aaeee58c:g:X44AAOSwjdFebqlH
"Mens Outerknown S.E.A Drifter Tapered Fit Jeans Size 31 x 31", $45.00, https://www.ebay.com/itm/Mens-Outerknown-S-E-A-Drifter-Tapered-Fit-Jeans-Size-31-x-31/133366907115?hash=item1f0d4980eb:g:564AAOSwOmBedWT-
"Outerknown Board Shorts Olive Green 34 Kelly Slater", $7.20, https://www.ebay.com/itm/Outerknown-Board-Shorts-Olive-Green-34-Kelly-Slater/303515396083?hash=item46aaed67f3:g:QDEAAOSwoGdebo1~
"Outerknown Sample Sale Drawstring Shorts Striped 34 Kelly Slater", $8.75, https://www.ebay.com/itm/Outerknown-Sample-Sale-Drawstring-Shorts-Striped-34-Kelly-Slater/303515392670?hash=item46aaed5a9e:g:HkQAAOSwd5Feboxt
"Outerknown Olive Green Shorts 34 Kelly Slater", $6.50, https://www.ebay.com/itm/Outerknown-Olive-Green-Shorts-34-Kelly-Slater/303515389071?hash=item46aaed4c8f:g:xbYAAOSwnWFebouS
"Outerknown x Levis wellthread Western Button Down shirt size small", $29.99, https://www.ebay.com/itm/Outerknown-x-Levis-wellthread-Western-Button-Down-shirt-size-small/164128771787?hash=item2636d64ecb:g:4SMAAOSwnTBeaDSB
"OUTERKNOWN Nomadic Polo Men’s Shirt XL Blue", $20.97, https://www.ebay.com/itm/OUTERKNOWN-Nomadic-Polo-Men-s-Shirt-XL-Blue/184111982430?hash=item2addede75e:g:igsAAOSwYUpeC5qE
"Men’s Outerknown Transitional Flannel Shirt Medium Gold New with tags", $25.00, https://www.ebay.com/itm/Men-s-Outerknown-Transitional-Flannel-Shirt-Medium-Gold-New-with-tags/333546132368?hash=item4da8e61390:g:Q1IAAOSwvXRebVT2
"Outerknown Blanket Shirt Flannel Dark Red Brown Brick Stripe Mens Size XL $148", $60.00, https://www.ebay.com/itm/Outerknown-Blanket-Shirt-Flannel-Dark-Red-Brown-Brick-Stripe-Mens-Size-XL-148/264648650971?hash=item3d9e49f0db:g:l18AAOSw9fleVxP6
"Outerknown Men Blanket Shirt multicolor stripe Size XL", $54.99, https://www.ebay.com/itm/Outerknown-Men-Blanket-Shirt-multicolor-stripe-Size-XL/303517999959?hash=item46ab152357:g:WXEAAOSw9h5ecljT
"Outerknown Portal Pocket Tee Men's Size M", $19.00, https://www.ebay.com/itm/Outerknown-Portal-Pocket-Tee-Mens-Size-M/283653624049?hash=item420b12d0f1:g:-vcAAOSwlPFdsmFY
"Outerknown sz S Flannel Blanket Shirt, Organic, Sustainable Cotton BNWT", $49.99, https://www.ebay.com/itm/Outerknown-sz-S-Flannel-Blanket-Shirt-Organic-Sustainable-Cotton-BNWT/223941260449?hash=item3423f074a1:g:Kr0AAOSwemdeZdDj
"Outerknown Blue Shorts 34 Kelly Slater", $5.00, https://www.ebay.com/itm/Outerknown-Blue-Shorts-34-Kelly-Slater/303515390562?hash=item46aaed5262:g:SF0AAOSwC4xebowJ
"Levis 511 Outerknown Rinse 30x30", $10.00, https://www.ebay.com/itm/Levis-511-Outerknown-Rinse-30x30/193378936701?hash=item2d0648677d:g:bBsAAOSwFfleaYHc
"OUTERKNOWN Mens Paz Pants Size Medium Black Stretch Tie Waist Slim", $45.00, https://www.ebay.com/itm/OUTERKNOWN-Mens-Paz-Pants-Size-Medium-Black-Stretch-Tie-Waist-Slim/153814912775?hash=item23d0154f07:g:bK8AAOSwVJFeMmP-
"Mens Outerknown Shirt Jacket Wool Nylon Large", $27.00, https://www.ebay.com/itm/Mens-Outerknown-Shirt-Jacket-Wool-Nylon-Large/174217162033?hash=item289026ed31:g:JGQAAOSwFqJeaSJc
"Levis X Outerknown Well thread Lined Trucker Jacket LARGE New Outer Known $185", $80.00, https://www.ebay.com/itm/Levis-X-Outerknown-Well-thread-Lined-Trucker-Jacket-LARGE-New-Outer-Known-185/124116716152?hash=item1ce5eeca78:g:UJ0AAOSwEbheSq22
"Levi's Wellthread x Outerknown Men's Trucker Denim Hemp Jean Jacket NEW NWT LRG", $54.95, https://www.ebay.com/itm/Levis-Wellthread-x-Outerknown-Mens-Trucker-Denim-Hemp-Jean-Jacket-NEW-NWT-LRG/264661650228?hash=item3d9f104b34:g:SggAAOSw4e1dPVef
"Outerknown Sample Sale Jeans 34x32 Kelly Slater", $5.00, https://www.ebay.com/itm/Outerknown-Sample-Sale-Jeans-34x32-Kelly-Slater/303515383842?hash=item46aaed3822:g:rYMAAOSwtixebopf
"Nwt Mens Outerknown Blanket Shirt Xl New Plaid Flannel", $84.99, https://www.ebay.com/itm/Nwt-Mens-Outerknown-Blanket-Shirt-Xl-New-Plaid-Flannel/223899425899?hash=item3421721c6b:g:KwEAAOSwl9xePumI
"Nwt Mens Outerknown Blanket Shirt Xl New Flannel Plaid", $84.99, https://www.ebay.com/itm/Nwt-Mens-Outerknown-Blanket-Shirt-Xl-New-Flannel-Plaid/223899430085?hash=item3421722cc5:g:HK0AAOSwFOlePuqA
"OUTERKNOWN Men's Size XL Short Sleeve Button Down Shirt Cotton Blue", $35.00, https://www.ebay.com/itm/OUTERKNOWN-Mens-Size-XL-Short-Sleeve-Button-Down-Shirt-Cotton-Blue/223901698583?hash=item342194ca17:g:AkoAAOSwN4BeQH46
"Outerknown Blanket Shirt Size L In Paprika Bodega Plaid Best Flannel Made", $75.00, https://www.ebay.com/itm/Outerknown-Blanket-Shirt-Size-L-In-Paprika-Bodega-Plaid-Best-Flannel-Made/283808941477?hash=item421454c5a5:g:-aEAAOSw1dVeZa9U
"Outerknown Blanket Shirt Size L In Mallard Bodega Plaid Best Flannel", $71.00, https://www.ebay.com/itm/Outerknown-Blanket-Shirt-Size-L-In-Mallard-Bodega-Plaid-Best-Flannel/283808934001?hash=item421454a871:g:3Z4AAOSwChheZa1E
"New $128 Levis WellThread X Outerknown Refibra Rinse 511 Slim Fit Mens Jeans", $49.98, https://www.ebay.com/itm/New-128-Levis-WellThread-X-Outerknown-Refibra-Rinse-511-Slim-Fit-Mens-Jeans/113700905303?hash=item1a791a2157:g:tvcAAOSw2S9cnWC7
"NWT Levi’s x Outerknown Wellthread Cotton Linen Trucker Jacket Size SMALL", $89.99, https://www.ebay.com/itm/NWT-Levi-s-x-Outerknown-Wellthread-Cotton-Linen-Trucker-Jacket-Size-SMALL/133057515964?epid=0&hash=item1efad891bc:g:jusAAOSwXC1c4gCF
"Outerknown Stringer Seersucker Pant - Marine - Men's Small", $19.99, https://www.ebay.com/itm/Outerknown-Stringer-Seersucker-Pant-Marine-Mens-Small/324032498968?hash=item4b71d78d18:g:19MAAOSwnhpdz15A
"NWT Mens Banks Journal Catamaran Quick Dry Walk Short 32 Rhythm Outerknown Trunk", $20.00, https://www.ebay.com/itm/NWT-Mens-Banks-Journal-Catamaran-Quick-Dry-Walk-Short-32-Rhythm-Outerknown-Trunk/133348023687?hash=item1f0c295d87:g:Ce4AAOSwDdxeWrVP
