"title", price, url
"  STATS for Brand: Outerknown, Items Scanned: 276, Total Items (Including sponsored): 276 Value (Without sponsored): $10603.08 ", , 
"OUTERKNOWN x LEVI'S Wellthread Mens Cotton/Hemp Denim Western Shirt 21549-0014", $45.00, https://www.ebay.com/itm/OUTERKNOWN-x-LEVIS-Wellthread-Mens-Cotton-Hemp-Denim-Western-Shirt-21549-0014/202977388827?hash=item2f4265291b:g:L~YAAOSw~K5eqCGJ
"Outerknown Men Shorts Elastic Waist Black Medium + Purple Tye Die T-Shirt Medium", $30.00, https://www.ebay.com/itm/Outerknown-Men-Shorts-Elastic-Waist-Black-Medium-Purple-Tye-Die-T-Shirt-Medium/193513993147?hash=item2d0e5533bb:g:VXkAAOSwbNte49jb
"Outerknown Blanket Shirt Blue Size Large", $60.00, https://www.ebay.com/itm/Outerknown-Blanket-Shirt-Blue-Size-Large/153938219947?hash=item23d76ed3ab:g:3wkAAOSwl6tewyZg
"Outerknown Mens 18" Verano Elastic Beach Shorts Grey XL New", $39.99, https://www.ebay.com/itm/Outerknown-Mens-18-Verano-Elastic-Beach-Shorts-Grey-XL-New/363019202569?hash=item5485a17009:g:1wwAAOSwGhBe4ogg
"Outerknown Mens Medium Hemp Organic Cotton Blend Orange S/S T Shirt", $23.99, https://www.ebay.com/itm/Outerknown-Mens-Medium-Hemp-Organic-Cotton-Blend-Orange-S-S-T-Shirt/274384842760?hash=item3fe29c7008:g:izAAAOSwoZte1bex
"OUTERKNOWN JACKET SWEATER & ROSE STONE WOVEN M", $73.00, https://www.ebay.com/itm/OUTERKNOWN-JACKET-SWEATER-ROSE-STONE-WOVEN-M/293603123689?hash=item445c1c21e9:g:aAcAAOSwgaVe2ZV7
"Outerknown Wildwood Swim Trunks/ Boardshorts 30 Asphalt", $28.00, https://www.ebay.com/itm/Outerknown-Wildwood-Swim-Trunks-Boardshorts-30-Asphalt/164227628025?hash=item263cbabbf9:g:AD0AAOSwTmRdSyJl
"Outerknown Zip Up Hoodie Size xl", $45.00, https://www.ebay.com/itm/Outerknown-Zip-Up-Hoodie-Size-xl/254588245510?hash=item3b46a45606:g:a1cAAOSwXbZesOmY
"Levis x Outerknown 511 30x32 Dark Rinse", $20.00, https://www.ebay.com/itm/Levis-x-Outerknown-511-30x32-Dark-Rinse/274385201843?hash=item3fe2a1eab3:g:jiAAAOSwETxekw0g
"NWOT Outerknown Coach’s Jacket Size Medium Army Cotton Surf Slater Spring New", $35.00, https://www.ebay.com/itm/NWOT-Outerknown-Coach-s-Jacket-Size-Medium-Army-Cotton-Surf-Slater-Spring-New/254615465649?hash=item3b4843aeb1:g:ZWgAAOSws4NeeWlW
"NWT Outerknown Nomadic Swim Trunk Sz 38 Solid Blue Board Shorts", $35.00, https://www.ebay.com/itm/NWT-Outerknown-Nomadic-Swim-Trunk-Sz-38-Solid-Blue-Board-Shorts/174202463133?hash=item288f46a39d:g:hNEAAOSwbn1eVbk1
"outerknown OK tshirt medium organic cotton kelly slater", $14.50, https://www.ebay.com/itm/outerknown-OK-tshirt-medium-organic-cotton-kelly-slater/193491060913?hash=item2d0cf748b1:g:sxYAAOSwMThe1IYm
"MODERN Outerknown Charcoal Brushed Flannel Navy Side Stripe Button Down Shirt M", $13.00, https://www.ebay.com/itm/MODERN-Outerknown-Charcoal-Brushed-Flannel-Navy-Side-Stripe-Button-Down-Shirt-M/353090130216?hash=item5235cfd128:g:-ToAAOSwzLVe0Dog
"Levi's x Outerknown Men's US L Cotton Denim Western Shirt Drk Blue", $26.00, https://www.ebay.com/itm/Levis-x-Outerknown-Mens-US-L-Cotton-Denim-Western-Shirt-Drk-Blue/402282800435?hash=item5da9ec6533:g:J6wAAOSwBuVe1lgr
"OUTERKNOWN S.E.A. Pocket tee shirt men's new XL", $24.95, https://www.ebay.com/itm/OUTERKNOWN-S-E-A-Pocket-tee-shirt-mens-new-XL/184112011127?hash=item2addee5777:g:mcUAAOSwXq5eDUM1
"OUTERKNOWN Men's S/S Button Shirt ESSENTIAL - SNV - XLarge - NWT", $48.00, https://www.ebay.com/itm/OUTERKNOWN-Mens-S-S-Button-Shirt-ESSENTIAL-SNV-XLarge-NWT/392575782618?hash=item5b67570eda:g:GkIAAOSw55pd7Bi-
"OUTERKNOWN Men's SS ISIDRO Crew T Shirt Chest Pocket Striped Hemp Cotton XL NEW", $30.00, https://www.ebay.com/itm/OUTERKNOWN-Mens-SS-ISIDRO-Crew-T-Shirt-Chest-Pocket-Striped-Hemp-Cotton-XL-NEW/283903180870?hash=item4219f2c046:g:ta8AAOSwLrle2ZBX
"Outerknown S.E.A. Shorts Mens", $47.00, https://www.ebay.com/itm/Outerknown-S-E-A-Shorts-Mens/363010329650?hash=item54851a0c32:g:GVgAAOSwtVde1YRd
"NWT Levi’s 511 Slim Fit Jeans Wellthread Outerknown Denim Mens 34x30 Brand New", $60.00, https://www.ebay.com/itm/NWT-Levi-s-511-Slim-Fit-Jeans-Wellthread-Outerknown-Denim-Mens-34x30-Brand-New/124128163284?hash=item1ce69d75d4:g:YFsAAOSwh~NeeXXj
"Outerknown by Kelly Slater Signature Recycled Hemp Polo Shirt, Size XL, Black", $0.99, https://www.ebay.com/itm/Outerknown-by-Kelly-Slater-Signature-Recycled-Hemp-Polo-Shirt-Size-XL-Black/133420485164?hash=item1f107b0a2c:g:D6sAAOSwLsBezA63
"OUTERKNOWN Transitional Flannel | Green | Organic Cotton | Size Medium", $9.25, https://www.ebay.com/itm/OUTERKNOWN-Transitional-Flannel-Green-Organic-Cotton-Size-Medium/324180188684?hash=item4b7aa51e0c:g:rvkAAOSwVOtezwbc
"OUTERKNOWN Transitional Flannel | Blue | Organic Cotton | Size Medium", $10.50, https://www.ebay.com/itm/OUTERKNOWN-Transitional-Flannel-Blue-Organic-Cotton-Size-Medium/324180180102?hash=item4b7aa4fc86:g:ZSMAAOSwKRteywNQ
"NWT Levis x Outerknown Western L/S Button Front Shirt Men’s Size Medium", $44.99, https://www.ebay.com/itm/NWT-Levis-x-Outerknown-Western-L-S-Button-Front-Shirt-Men-s-Size-Medium/124206095614?hash=item1ceb429cfe:g:CEEAAOSwbR9e0rDa
"Outerknown Stinson Heavyweight Tee", $19.00, https://www.ebay.com/itm/Outerknown-Stinson-Heavyweight-Tee/163962715401?hash=item262cf07d09:g:9zEAAOSwxjxd3au4
"OUTERKNOWN Men's Heavy Evolution Shirt Jacket Quilted Lining Reversible Size M", $129.99, https://www.ebay.com/itm/OUTERKNOWN-Mens-Heavy-Evolution-Shirt-Jacket-Quilted-Lining-Reversible-Size-M/274349544398?hash=item3fe081d3ce:g:e~8AAOSwngBeYZow
"Outerknown, Men’s SEA Jeans, Straight Fit, Faded Indigo, 32 X 32, Brand New", $78.00, https://www.ebay.com/itm/Outerknown-Men-s-SEA-Jeans-Straight-Fit-Faded-Indigo-32-X-32-Brand-New/324134100280?hash=item4b77e5dd38:g:2JgAAOSw1mdek5lt
"outerknown straight jeans size 34", $50.00, https://www.ebay.com/itm/outerknown-straight-jeans-size-34/293427953059?hash=item4451ab3da3:g:L3kAAOSwZ15eIP5K
"Outerknown surfer camp Collar Beach Casual Shirt Green & Black stripe M", $22.99, https://www.ebay.com/itm/Outerknown-surfer-camp-Collar-Beach-Casual-Shirt-Green-Black-stripe-M/233607715644?hash=item36641adb3c:g:AP8AAOSwOFZe1rBS
"Outerknown Nomadic Thermal long sleeve shirt", $34.99, https://www.ebay.com/itm/Outerknown-Nomadic-Thermal-long-sleeve-shirt/193488518514?hash=item2d0cd07d72:g:o~kAAOSwY4NelPa~
"Outerknown Mens Hoodie Blue Long Sleeve Full Zip Sweater Top Size M New", $68.00, https://www.ebay.com/itm/Outerknown-Mens-Hoodie-Blue-Long-Sleeve-Full-Zip-Sweater-Top-Size-M-New/283879244443?hash=item421885829b:g:WkgAAOSwQVZevhO5
"NWOT Outerknown Coach’s Jacket Size Medium Army Cotton Surf Slater Spring New", $35.00, https://www.ebay.com/itm/NWOT-Outerknown-Coach-s-Jacket-Size-Medium-Army-Cotton-Surf-Slater-Spring-New/254608632875?hash=item3b47db6c2b:g:ZWgAAOSws4NeeWlW
"Levis X Outerknown Wellthread Lined Trucker Jacket Small New with tags $185 MSRP", $35.00, https://www.ebay.com/itm/Levis-X-Outerknown-Wellthread-Lined-Trucker-Jacket-Small-New-with-tags-185-MSRP/184308008437?hash=item2ae99d05f5:g:3d0AAOSwwgVep2~1
"Outerknown Ocotillo Shirt Size M Organic Cotton Long Sleeve Button NEW", $33.00, https://www.ebay.com/itm/Outerknown-Ocotillo-Shirt-Size-M-Organic-Cotton-Long-Sleeve-Button-NEW/303583759497?hash=item46af008c89:g:o58AAOSwX~heilvn
"Outerknown Lost Coast Moleskin Shirt M Navy Blue LS Button NWT SOLD OUT RARE", $54.00, https://www.ebay.com/itm/Outerknown-Lost-Coast-Moleskin-Shirt-M-Navy-Blue-LS-Button-NWT-SOLD-OUT-RARE/333612975089?hash=item4dace203f1:g:vU8AAOSwJ9RewY58
"NWT $128 - Outerknown Casual Extra Soft Button Up Size: US S / EU 44-46 / 1", $80.00, https://www.ebay.com/itm/NWT-128-Outerknown-Casual-Extra-Soft-Button-Up-Size-US-S-EU-44-46-1/283826594752?hash=item42156223c0:g:dK4AAOSw~O1eexJ9
"Levi's x Outerknown Men's US L Cotton Denim Western Shirt Drk Blue", $27.00, https://www.ebay.com/itm/Levis-x-Outerknown-Mens-US-L-Cotton-Denim-Western-Shirt-Drk-Blue/402276401535?hash=item5da98ac17f:g:YVMAAOSwxbJeznOg
"NEW Levi's Wellthread x Outerknown Cotton Linen Long Sleeve Shirt S", $4.99, https://www.ebay.com/itm/NEW-Levis-Wellthread-x-Outerknown-Cotton-Linen-Long-Sleeve-Shirt-S/184307401399?hash=item2ae993c2b7:g:Ba0AAOSwqRFevrc3
"Outerknown Ocotillo Shirt Size M Organic Cotton Long Sleeve Button NEW", $25.00, https://www.ebay.com/itm/Outerknown-Ocotillo-Shirt-Size-M-Organic-Cotton-Long-Sleeve-Button-NEW/303577562429?hash=item46aea1fd3d:g:o58AAOSwX~heilvn
"Outerknown Depot Shirt Size M Organic Cotton Long Sleeve Button NEW", $29.99, https://www.ebay.com/itm/Outerknown-Depot-Shirt-Size-M-Organic-Cotton-Long-Sleeve-Button-NEW/303577560347?hash=item46aea1f51b:g:t1sAAOSwFIpeilj5
"Outerknown Lost Coast Moleskin Shirt M Navy Blue LS Button NWT SOLD OUT RARE", $54.00 $87.00, https://www.ebay.com/itm/Outerknown-Lost-Coast-Moleskin-Shirt-M-Navy-Blue-LS-Button-NWT-SOLD-OUT-RARE/333607377306?hash=item4dac8c999a:g:vU8AAOSwJ9RewY58
"LEVI'S Mens WELLTHREAD OUTERKNOWN White Denim Jean Jacket 24766-0005 Size L", $62.74, https://www.ebay.com/itm/LEVIS-Mens-WELLTHREAD-OUTERKNOWN-White-Denim-Jean-Jacket-24766-0005-Size-L/362739497457?hash=item5474f579f1:g:9aYAAOSwABddZ-UN
"OUTERKNOWN Men’s NAVY T Shirt Organic Cotton By KELLY SLATER MED New with Tags", $44.86, https://www.ebay.com/itm/OUTERKNOWN-Men-s-NAVY-T-Shirt-Organic-Cotton-By-KELLY-SLATER-MED-New-with-Tags/324170759556?hash=item4b7a153d84:g:wE8AAOSwG39ew2pO
"Outerknown X Levis Wellthread 502 Taper Fit", $50.00, https://www.ebay.com/itm/Outerknown-X-Levis-Wellthread-502-Taper-Fit/163962739863?hash=item262cf0dc97:g:pmAAAOSwuOZd3a6Q
"Outerknown Jacket XL WOW!", $18.95, https://www.ebay.com/itm/Outerknown-Jacket-XL-WOW/324177720220?hash=item4b7a7f739c:g:W1cAAOSwIzpexGaU
"Outerknown Gray Long Sleeve Henley M", $25.00, https://www.ebay.com/itm/Outerknown-Gray-Long-Sleeve-Henley-M/143597833042?hash=item216f190b52:g:scMAAOSwWHZesv-X
"NWT Outerknown Organic Hemp Traveler Chino Mens Casual Shorts Sz.32", $39.99, https://www.ebay.com/itm/NWT-Outerknown-Organic-Hemp-Traveler-Chino-Mens-Casual-Shorts-Sz-32/264616661423?hash=item3d9c61d1af:g:YVYAAOSwh~peMqYY
"Outerknown "It's Not OK" pocket t-shirt, new with tags", $24.00, https://www.ebay.com/itm/Outerknown-Its-Not-OK-pocket-t-shirt-new-with-tags/143588032302?hash=item216e837f2e:g:ibcAAOSwhQleojVY
"Levis x Outerknown 511 30x32 Dark Rinse", $20.00, https://www.ebay.com/itm/Levis-x-Outerknown-511-30x32-Dark-Rinse/274371235772?hash=item3fe1cccfbc:g:jiAAAOSwETxekw0g
"Levis X Outerknown Wellthread Lined Trucker Jacket Small New with tags $185 MSRP", $35.00, https://www.ebay.com/itm/Levis-X-Outerknown-Wellthread-Lined-Trucker-Jacket-Small-New-with-tags-185-MSRP/184302148731?hash=item2ae9439c7b:g:3d0AAOSwwgVep2~1
"Outerknown Mens Brushed Highline L/S Flannel Red Plaid S New", $63.74, https://www.ebay.com/itm/Outerknown-Mens-Brushed-Highline-L-S-Flannel-Red-Plaid-S-New/233385984174?hash=item3656e380ae:g:UPgAAOSw19JduwNQ
"Outerknown Levi’s 511 Jeans 30x30", $3.70 $40.00, https://www.ebay.com/itm/Outerknown-Levi-s-511-Jeans-30x30/233593057844?hash=item36633b3234:g:iOsAAOSwcONeej95
"Levi's x Outerknown Men's US L Cotton Denim Western Shirt Drk Blue", $26.00, https://www.ebay.com/itm/Levis-x-Outerknown-Mens-US-L-Cotton-Denim-Western-Shirt-Drk-Blue/402269606022?hash=item5da9231086:g:cvsAAOSwa2Zexn0~
"OUTERKNOWN Bahia Men’s T Shirt Organic Cotton By KELLY SLATER MED New with Tags", $44.86, https://www.ebay.com/itm/OUTERKNOWN-Bahia-Men-s-T-Shirt-Organic-Cotton-By-KELLY-SLATER-MED-New-with-Tags/224015584736?hash=item34285e8de0:g:Yr0AAOSwuHRew2fS
"Outerknown Woolaroo Men's Boardshorts / Trunks - Brand New", $75.00, https://www.ebay.com/itm/Outerknown-Woolaroo-Mens-Boardshorts-Trunks-Brand-New/233396866086?hash=item3657898c26:g:UNsAAOSwi5FdMzWw
"Outerknown LE Kelly Slater Graphic T-shirt Organic Size Large", $35.00, https://www.ebay.com/itm/Outerknown-LE-Kelly-Slater-Graphic-T-shirt-Organic-Size-Large/264673249509?hash=item3d9fc148e5:g:lu8AAOSwqqJec-0y
"NWOT Outerknown Coach’s Jacket Size Medium Army Cotton Surf Slater Spring New", $40.00, https://www.ebay.com/itm/NWOT-Outerknown-Coach-s-Jacket-Size-Medium-Army-Cotton-Surf-Slater-Spring-New/254601179130?hash=item3b4769affa:g:ZWgAAOSws4NeeWlW
"OUTERKNOWN No More Straws Tee 100% Organic Cotton pink NWT", $30.00, https://www.ebay.com/itm/OUTERKNOWN-No-More-Straws-Tee-100-Organic-Cotton-pink-NWT/303445866732?hash=item46a6c878ec:g:ZJoAAOSwSlVeHmSq
"Outerknown by Kelly Slater Evolution Trunk Boardshorts size 36 surf yoga", $23.00, https://www.ebay.com/itm/Outerknown-by-Kelly-Slater-Evolution-Trunk-Boardshorts-size-36-surf-yoga/313073208232?hash=item48e49e0ba8:g:kQ4AAOSw9fZesO19
"NEW Levi's Wellthread x Outerknown Cotton Linen Long Sleeve Shirt S", $5.50, https://www.ebay.com/itm/NEW-Levis-Wellthread-x-Outerknown-Cotton-Linen-Long-Sleeve-Shirt-S/184299385660?hash=item2ae919733c:g:Ba0AAOSwqRFevrc3
"Levis X Outerknown Western Flannel Button Up", $8.50, https://www.ebay.com/itm/Levis-X-Outerknown-Western-Flannel-Button-Up/184299385358?hash=item2ae919720e:g:-~gAAOSw~zdevrbP
"New Levi's x Outerknown 511 Slim Mens Jeans in Rinse 33x30", $33.00, https://www.ebay.com/itm/New-Levis-x-Outerknown-511-Slim-Mens-Jeans-in-Rinse-33x30/184296484158?hash=item2ae8ed2d3e:g:gjEAAOSwFFZeuHI8
"Outerknown Jacket XL WOW!", $26.90, https://www.ebay.com/itm/Outerknown-Jacket-XL-WOW/324171541527?hash=item4b7a212c17:g:W1cAAOSwIzpexGaU
"Outerknown Ocotillo Shirt Size M Organic Cotton Long Sleeve Button NEW", $25.00, https://www.ebay.com/itm/Outerknown-Ocotillo-Shirt-Size-M-Organic-Cotton-Long-Sleeve-Button-NEW/303570574417?hash=item46ae375c51:g:o58AAOSwX~heilvn
"Outerknown Depot Shirt Size M Organic Cotton Long Sleeve Button NEW", $29.99, https://www.ebay.com/itm/Outerknown-Depot-Shirt-Size-M-Organic-Cotton-Long-Sleeve-Button-NEW/303570570341?hash=item46ae374c65:g:t1sAAOSwFIpeilj5
"Outerknown Blanket Shirt Medium", $104.19, https://www.ebay.com/itm/Outerknown-Blanket-Shirt-Medium/193470523997?hash=item2d0bbdea5d:g:dr4AAOSw7kRewbGd
"Outerknown Blanket Shirt Medium", $38.00, https://www.ebay.com/itm/Outerknown-Blanket-Shirt-Medium/193470523134?hash=item2d0bbde6fe:g:ePsAAOSwb05ewbDc
"Outerknown Blanket Shirt Medium NWT", $66.00, https://www.ebay.com/itm/Outerknown-Blanket-Shirt-Medium-NWT/193470522130?hash=item2d0bbde312:g:fn8AAOSwt4hewbAw
"Outerknown Wildwood Swim Trunks/ Boardshorts 30 Asphalt", $28.00 $39.00, https://www.ebay.com/itm/Outerknown-Wildwood-Swim-Trunks-Boardshorts-30-Asphalt/164199551836?hash=item263b0e535c:g:AD0AAOSwTmRdSyJl
"Outerknown Men’s Shorts Size Medium", $20.00, https://www.ebay.com/itm/Outerknown-Men-s-Shorts-Size-Medium/174293927283?hash=item2894ba4573:g:J68AAOSwxJVeysbh
"NEW Outerknown Woolaroo Mens Boardshorts Trunks Size 38 Green Herb W9", $39.99, https://www.ebay.com/itm/NEW-Outerknown-Woolaroo-Mens-Boardshorts-Trunks-Size-38-Green-Herb-W9/223958077480?hash=item3424f11028:g:tdUAAOSwgaZenEs3
"Outerknown Woolaroo Mens Boardshorts Trunks Sz 38 Blue X1", $28.99, https://www.ebay.com/itm/Outerknown-Woolaroo-Mens-Boardshorts-Trunks-Sz-38-Blue-X1/223958080282?hash=item3424f11b1a:g:Rj0AAOSwj3NenNd9
"Outerknown Lost Coast Moleskin Shirt M Navy Blue LS Button NWT SOLD OUT RARE", $65.00 $87.00, https://www.ebay.com/itm/Outerknown-Lost-Coast-Moleskin-Shirt-M-Navy-Blue-LS-Button-NWT-SOLD-OUT-RARE/333601264472?hash=item4dac2f5358:g:vU8AAOSwJ9RewY58
"NWT Outerknown Highland Blanket Shirt Jacket Size Medium Blue/Grey Wool Blend", $89.00, https://www.ebay.com/itm/NWT-Outerknown-Highland-Blanket-Shirt-Jacket-Size-Medium-Blue-Grey-Wool-Blend/133413202125?hash=item1f100be8cd:g:EUgAAOSwAj9eU1vp
"Outerknown Stinson Tee Shirt Large Pewter", $7.60, https://www.ebay.com/itm/Outerknown-Stinson-Tee-Shirt-Large-Pewter/193468753637?hash=item2d0ba2e6e5:g:6cIAAOSw161ewFGc
"Outerknown Stinson Tee Shirt Large Pewter", $10.50, https://www.ebay.com/itm/Outerknown-Stinson-Tee-Shirt-Large-Pewter/193468753300?hash=item2d0ba2e594:g:6cIAAOSw161ewFGc
"Outerknown Stinson Tee Shirt Large Denim", $7.55, https://www.ebay.com/itm/Outerknown-Stinson-Tee-Shirt-Large-Denim/193468752317?hash=item2d0ba2e1bd:g:SiQAAOSwgrxewFDD
"Outerknown Stinson Tee Shirt Large Denim", $14.07, https://www.ebay.com/itm/Outerknown-Stinson-Tee-Shirt-Large-Denim/193468751751?hash=item2d0ba2df87:g:SiQAAOSwgrxewFDD
"Outerknown Transitional Flannel Medium", $26.26, https://www.ebay.com/itm/Outerknown-Transitional-Flannel-Medium/193468746716?hash=item2d0ba2cbdc:g:8AQAAOSw6fJewE-c
"Outerknown Transitional Flannel Medium", $17.50, https://www.ebay.com/itm/Outerknown-Transitional-Flannel-Medium/193468744766?hash=item2d0ba2c43e:g:wewAAOSw87xewE7d
"Outerknown Sojourn Tee Shirt Large", $20.50, https://www.ebay.com/itm/Outerknown-Sojourn-Tee-Shirt-Large/193468741225?hash=item2d0ba2b669:g:~ukAAOSwdlNewE42
"Outerknown Trails Henley LS Tee", $26.00, https://www.ebay.com/itm/Outerknown-Trails-Henley-LS-Tee/193468739214?hash=item2d0ba2ae8e:g:OJ8AAOSwLg1ewE1C
"Outerknown Terra Pocket Tee Large", $12.50, https://www.ebay.com/itm/Outerknown-Terra-Pocket-Tee-Large/193468736248?hash=item2d0ba2a2f8:g:BykAAOSwJC1ewExz
"Outerknown Nomadic Polo Shirt Medium", $15.00, https://www.ebay.com/itm/Outerknown-Nomadic-Polo-Shirt-Medium/193468726483?hash=item2d0ba27cd3:g:970AAOSwOzxewEm8
"Outerknown Nomadic Polo Shirt Medium", $10.50, https://www.ebay.com/itm/Outerknown-Nomadic-Polo-Shirt-Medium/193468724883?hash=item2d0ba27693:g:Rr0AAOSwXspewElH
"Outerknown Nomadic Polo Shirt Medium", $21.50, https://www.ebay.com/itm/Outerknown-Nomadic-Polo-Shirt-Medium/193468723761?hash=item2d0ba27231:g:2M4AAOSwwEpewEjx
"Outerknown Nomadic Polo Shirt Medium", $10.50, https://www.ebay.com/itm/Outerknown-Nomadic-Polo-Shirt-Medium/193468722343?hash=item2d0ba26ca7:g:KikAAOSwGD9ewEiH
"Outerknown Nomadic Polo Shirt Medium", $10.50, https://www.ebay.com/itm/Outerknown-Nomadic-Polo-Shirt-Medium/193468721449?hash=item2d0ba26929:g:19sAAOSwZrRewEfm
"Outerknown Nomadic Polo Shirt Medium", $16.50, https://www.ebay.com/itm/Outerknown-Nomadic-Polo-Shirt-Medium/193468718506?hash=item2d0ba25daa:g:nRwAAOSwNHZewEcL
"Outerknown Nomadic Polo Shirt Medium", $26.00, https://www.ebay.com/itm/Outerknown-Nomadic-Polo-Shirt-Medium/193468717507?hash=item2d0ba259c3:g:ziAAAOSwAwFewEYi
"Outerknown "S.E.A." Shirt Size M Organic Cotton Short Sleeve Button NEW", $20.00, https://www.ebay.com/itm/Outerknown-S-E-A-Shirt-Size-M-Organic-Cotton-Short-Sleeve-Button-NEW/303564187225?hash=item46add5e659:g:lckAAOSw-~peilUj
"Levis X Outerknown Wellthread Lined Trucker Jacket Small New with tags $185 MSRP", $35.00, https://www.ebay.com/itm/Levis-X-Outerknown-Wellthread-Lined-Trucker-Jacket-Small-New-with-tags-185-MSRP/184296495588?hash=item2ae8ed59e4:g:3d0AAOSwwgVep2~1
"Outerknown Washed Blue Hoodie With Pocket On The Front. Large", $24.00, https://www.ebay.com/itm/Outerknown-Washed-Blue-Hoodie-With-Pocket-On-The-Front-Large/124188514904?hash=item1cea365a58:g:iYcAAOSwaldevyWK
"Levis X Outerknown Wellthread lined Mens Trucker dark Denim Jacket Size XL NWT", $98.99, https://www.ebay.com/itm/Levis-X-Outerknown-Wellthread-lined-Mens-Trucker-dark-Denim-Jacket-Size-XL-NWT/362961458090?epid=16035012329&hash=item54823053aa:g:Gs8AAOSwqOxehPDo
"mens Large Outerknown Olive Green Jacket", $51.00, https://www.ebay.com/itm/mens-Large-Outerknown-Olive-Green-Jacket/313081634416?hash=item48e51e9e70:g:cT8AAOSwOINevCpH
"NEW Levi's Wellthread x Outerknown Cotton Linen Long Sleeve Shirt S", $18.40, https://www.ebay.com/itm/NEW-Levis-Wellthread-x-Outerknown-Cotton-Linen-Long-Sleeve-Shirt-S/184293446222?hash=item2ae8bed24e:g:Ba0AAOSwqRFevrc3
"Levis X Outerknown Western Flannel Button Up", $19.40, https://www.ebay.com/itm/Levis-X-Outerknown-Western-Flannel-Button-Up/184293444902?hash=item2ae8becd26:g:-~gAAOSw~zdevrbP
"Levi's x Outerknown Men's US L Cotton Denim Western Shirt Drk Blue", $34.00, https://www.ebay.com/itm/Levis-x-Outerknown-Mens-US-L-Cotton-Denim-Western-Shirt-Drk-Blue/402263409205?hash=item5da8c48235:g:JKQAAOSwVp1evoms
"OUTERKNOWN Men’s NAVY Towelling Jumper By KELLY SLATER LARGE New with Tags", $55.21, https://www.ebay.com/itm/OUTERKNOWN-Men-s-NAVY-Towelling-Jumper-By-KELLY-SLATER-LARGE-New-with-Tags/324170769994?hash=item4b7a15664a:g:foIAAOSw1Vdew3Mt
"Outerknown Men’s Long Sleeve Callao L/S Crew Shirt Large", $27.99, https://www.ebay.com/itm/Outerknown-Men-s-Long-Sleeve-Callao-L-S-Crew-Shirt-Large/324027692390?hash=item4b718e3566:g:rLwAAOSwMlheCl4I
"Outerknown Levi’s 511 Jeans 30x30", $3.70 $40.00, https://www.ebay.com/itm/Outerknown-Levi-s-511-Jeans-30x30/233585905206?hash=item3662ce0e36:g:iOsAAOSwcONeej95
"Outerknown "S.E.A." Shirt Size M Organic Cotton Long Sleeve Button NEW", $33.00, https://www.ebay.com/itm/Outerknown-S-E-A-Shirt-Size-M-Organic-Cotton-Long-Sleeve-Button-NEW/303564186540?hash=item46add5e3ac:g:6tkAAOSwPRteildW
"Outerknown "S.E.A." Shirt Size M Organic Cotton Long Sleeve Button NEW", $29.99, https://www.ebay.com/itm/Outerknown-S-E-A-Shirt-Size-M-Organic-Cotton-Long-Sleeve-Button-NEW/303570570635?hash=item46ae374d8b:g:mvsAAOSwkTVeilpn
"NWOT Outerknown Coach’s Jacket Size Medium Army Cotton Surf Slater Spring New", $40.00, https://www.ebay.com/itm/NWOT-Outerknown-Coach-s-Jacket-Size-Medium-Army-Cotton-Surf-Slater-Spring-New/254594533142?hash=item3b47044716:g:ZWgAAOSws4NeeWlW
"Levis X Outerknown Wellthread Lined Trucker Jacket Small New with tags $185 MSRP", $35.00, https://www.ebay.com/itm/Levis-X-Outerknown-Wellthread-Lined-Trucker-Jacket-Small-New-with-tags-185-MSRP/184289968483?hash=item2ae889c163:g:3d0AAOSwwgVep2~1
"Outerknown Ocotillo Shirt Size M Organic Cotton Long Sleeve Button NEW", $29.99, https://www.ebay.com/itm/Outerknown-Ocotillo-Shirt-Size-M-Organic-Cotton-Long-Sleeve-Button-NEW/303564193699?hash=item46add5ffa3:g:o58AAOSwX~heilvn
"Outerknown "S.E.A." Shirt Size M Organic Cotton Long Sleeve Button NEW", $29.99, https://www.ebay.com/itm/Outerknown-S-E-A-Shirt-Size-M-Organic-Cotton-Long-Sleeve-Button-NEW/303564191657?hash=item46add5f7a9:g:mvsAAOSwkTVeilpn
"Outerknown Depot Shirt Size M Organic Cotton Long Sleeve Button NEW", $29.99, https://www.ebay.com/itm/Outerknown-Depot-Shirt-Size-M-Organic-Cotton-Long-Sleeve-Button-NEW/303564191318?hash=item46add5f656:g:t1sAAOSwFIpeilj5
"Levis 511 Premium Slim Fit Men's Jeans WellThread X Outerknown #2927", $70.00, https://www.ebay.com/itm/Levis-511-Premium-Slim-Fit-Mens-Jeans-WellThread-X-Outerknown-2927/324047621453?hash=item4b72be4d4d:g:LeAAAOSwZedeJQ39
"New Levi's x Outerknown 511 Slim Mens Jeans in Rinse 33x30", $29.99, https://www.ebay.com/itm/New-Levis-x-Outerknown-511-Slim-Mens-Jeans-in-Rinse-33x30/184287305469?hash=item2ae8611efd:g:gjEAAOSwFFZeuHI8
"OUTERKNOWN Men's Button Down Oxford Work Shirt Blue $88 Retail Size Medium", $25.00, https://www.ebay.com/itm/OUTERKNOWN-Mens-Button-Down-Oxford-Work-Shirt-Blue-88-Retail-Size-Medium/114037655641?hash=item1a8d2c8859:g:6F8AAOSwgrBeB9un
"Outerknown Men’s 33 x 32 Tapered Fit Sea Jeans Pants", $17.99, https://www.ebay.com/itm/Outerknown-Men-s-33-x-32-Tapered-Fit-Sea-Jeans-Pants/293577633157?hash=item445a972d85:g:a4sAAOSw50VeEwua
"Outerknown S.E.A Legs Pants 32", $20.00, https://www.ebay.com/itm/Outerknown-S-E-A-Legs-Pants-32/184293463160?hash=item2ae8bf1478:g:ef8AAOSwCgRevrpd
"Outerknown Shorts Olive Army Green Surf Kelly Slater Size 32 NWOT", $15.00, https://www.ebay.com/itm/Outerknown-Shorts-Olive-Army-Green-Surf-Kelly-Slater-Size-32-NWOT/373049343550?hash=item56db793e3e:g:KV4AAOSwxGheDjbt
"Outerknown Sur Hemp Cotton French Terry Thick Crewneck Pullover Sweatshirt Sz. M", $49.99, https://www.ebay.com/itm/Outerknown-Sur-Hemp-Cotton-French-Terry-Thick-Crewneck-Pullover-Sweatshirt-Sz-M/264657518458?hash=item3d9ed13f7a:g:rEYAAOSwL5BeYXoi
"NWT - Levi's x Outerknown "wave" T-shirt", $30.00, https://www.ebay.com/itm/NWT-Levis-x-Outerknown-wave-T-shirt/283852232675?hash=item4216e957e3:g:UsEAAOSwL9pem41U
"Levi's® WellThread™ x Outerknown Lined Sherpa Trucker Jacket Men's Small $298.00", $89.99, https://www.ebay.com/itm/Levis-WellThread-x-Outerknown-Lined-Sherpa-Trucker-Jacket-Mens-Small-298-00/283851196483?hash=item4216d98843:g:q8UAAOSwq4Neq258
"OUTERKNOWN Men's Coral Sur Full Zip Hoodie Size XL 55% Hemp 45% Organic Cotton", $24.00, https://www.ebay.com/itm/OUTERKNOWN-Mens-Coral-Sur-Full-Zip-Hoodie-Size-XL-55-Hemp-45-Organic-Cotton/223839635656?hash=item341de1c8c8:g:-UoAAOSwbn1eILxu
"Levi’s X Outerknown Trucker Jacket Size Medium Linen Cotton Wellthread", $108.45, https://www.ebay.com/itm/Levi-s-X-Outerknown-Trucker-Jacket-Size-Medium-Linen-Cotton-Wellthread/233178422587?epid=15030493842&hash=item364a845d3b:g:wC4AAOSwM7lcjU6y
"Outerknown - Men’s Relax Drawstring Terrycloth Lounge tide Shorts - large Navy", $18.00, https://www.ebay.com/itm/Outerknown-Men-s-Relax-Drawstring-Terrycloth-Lounge-tide-Shorts-large-Navy/264731218761?hash=item3da335d349:g:kMcAAOSwsypevfNJ
"Outerknown Verano Beach Pant Sz. Small Hemp Organic Cotton", $45.00, https://www.ebay.com/itm/Outerknown-Verano-Beach-Pant-Sz-Small-Hemp-Organic-Cotton/164022488261?hash=item2630808cc5:g:dWoAAOSw8OteFScA
"OUTERKNOWN TRANSITIONAL FLANNEL Size Medium", $16.99, https://www.ebay.com/itm/OUTERKNOWN-TRANSITIONAL-FLANNEL-Size-Medium/193463450963?hash=item2d0b51fd53:g:JxwAAOSwGhRepI87
"Levi's x Outerknown Men's US L Cotton Denim Western Shirt Drk Blue", $53.00, https://www.ebay.com/itm/Levis-x-Outerknown-Mens-US-L-Cotton-Denim-Western-Shirt-Drk-Blue/383539265519?hash=item594cb8bfef:g:qakAAOSweh5etroX
"outerknown large Navy Blue Puffer Jacket", $31.00, https://www.ebay.com/itm/outerknown-large-Navy-Blue-Puffer-Jacket/283849001267?hash=item4216b80933:g:lu0AAOSwJjtel559
"NWT Outerknown Highland Blanket Shirt Jacket Size Medium Blue/Grey Wool Blend", $89.00, https://www.ebay.com/itm/NWT-Outerknown-Highland-Blanket-Shirt-Jacket-Size-Medium-Blue-Grey-Wool-Blend/133404289892?hash=item1f0f83eb64:g:EUgAAOSwAj9eU1vp
