"Stio Men's L Environ snowpant bibs - Waterproof Breathable Resort Backcountry", eBay, $117.00, Sold: May-16, Unknown, https://www.ebay.com/itm/Stio-Mens-L-Environ-snowpant-bibs-Waterproof-Breathable-Resort-Backcountry/224004850307?hash=item3427bac283:g:M04AAOSwXepepIJz
"Stio Jackson Hole Cfs Hooded Jacket Cayenne Xl", eBay, $68.00, Sold: May-15, XLarge, https://www.ebay.com/itm/Stio-Jackson-Hole-Cfs-Hooded-Jacket-Cayenne-Xl/264699103480?hash=item3da14bc8f8:g:eUEAAOSw1dVelOwS
"Stio Womens Divide Shirt Button Down Size M Larkspur Blue 3/4 Sleeves", eBay, $17.99, Sold: May-15, Unknown, https://www.ebay.com/itm/Stio-Womens-Divide-Shirt-Button-Down-Size-M-Larkspur-Blue-3-4-Sleeves/283872210485?hash=item42181a2e35:g:UdIAAOSwA7Jee4Pr
"Stio Pinion Down Sweater  Men's Large  Boundary Black - FREE SHIPPING!", eBay, $82.00, Sold: May-15, Large, https://www.ebay.com/itm/Stio-Pinion-Down-Sweater-Mens-Large-Boundary-Black-FREE-SHIPPING/174276212446?hash=item2893abf6de:g:iF0AAOSwzcletZ8y
"Stio Mens Large Mineral Yellow Half Zip Pullover Jacket NEW", eBay, $44.99, Sold: May-15, Large, https://www.ebay.com/itm/Stio-Mens-Large-Mineral-Yellow-Half-Zip-Pullover-Jacket-NEW/274365249964?hash=item3fe17179ac:g:DFMAAOSw6xxevGdN
"Stio Women’s Divide Tank Medium", eBay, $20.00, Sold: May-14, Medium, https://www.ebay.com/itm/Stio-Women-s-Divide-Tank-Medium/164194761647?hash=item263ac53baf:g:u4MAAOSwq4Neua0c
"Stio Sweetwater Fleece hoodie Olive Green  medium  Women's", eBay, $39.00, Sold: May-14, Medium, https://www.ebay.com/itm/Stio-Sweetwater-Fleece-hoodie-Olive-Green-medium-Womens/274331186533?hash=item3fdf69b565:g:M~kAAOSwxOlejgtm
"(3) Men’s XL Shirts (never worn)  Patagonia  Marmot & Stio", eBay, $50.00, Sold: May-13, XLarge, https://www.ebay.com/itm/3-Men-s-XL-Shirts-never-worn-Patagonia-Marmot-Stio/153930706725?hash=item23d6fc2f25:g:7RUAAOSwLY1eu~j8
"Stio Mens Large Topographic Hoodie Grey NEW", eBay, $39.99, Sold: May-13, Large, https://www.ebay.com/itm/Stio-Mens-Large-Topographic-Hoodie-Grey-NEW/274365281366?hash=item3fe171f456:g:5QUAAOSw-0VevHVX
"STIO Women's Azura Insulated Jacket Small Olive Green Excellent Condition!!!", eBay, $45.00, Sold: May-13, Small, https://www.ebay.com/itm/STIO-Womens-Azura-Insulated-Jacket-Small-Olive-Green-Excellent-Condition/333595908350?hash=item4dabdd98fe:g:N64AAOSw1fJeuKvt
"NWT Stio Men's Hometown Down Hooded Vest Large L MSRP $189", eBay, $125.00, Sold: May-13, Large, https://www.ebay.com/itm/NWT-Stio-Mens-Hometown-Down-Hooded-Vest-Large-L-MSRP-189/202988177633?hash=item2f4309c8e1:g:-KQAAOSwDcNeuYbK
"Stio Men’s Half-Zip Pullover - Large", eBay, $27.00, Sold: May-11, Large, https://www.ebay.com/itm/Stio-Men-s-Half-Zip-Pullover-Large/283868100430?hash=item4217db774e:g:TFEAAOSw5nxesLQl
"Stio Mens Pocket Tech Tee Medium Grey", eBay, $10.50, Sold: May-11, Medium, https://www.ebay.com/itm/Stio-Mens-Pocket-Tech-Tee-Medium-Grey/324156056413?hash=item4b7934e35d:g:CIoAAOSwSnZesIp0
"Lot of 3 Large Stio Mens Eddy Shirts", eBay, $150.00, Sold: May-11, Large, https://www.ebay.com/itm/Lot-of-3-Large-Stio-Mens-Eddy-Shirts/293575936991?hash=item445a7d4bdf:g:11YAAOSwO9leuIjq
"Womens STIO Sidley Button Front Blouse Size XL", eBay, $35.00, Sold: May-11, XLarge, https://www.ebay.com/itm/Womens-STIO-Sidley-Button-Front-Blouse-Size-XL/224005089965?hash=item3427be6aad:g:4bUAAOSwnexetz-D
"Stio Women's Modis Hooded Jacket Size XL Storm Cloud Waterproof", eBay, $35.99, Sold: May-9, XLarge, https://www.ebay.com/itm/Stio-Womens-Modis-Hooded-Jacket-Size-XL-Storm-Cloud-Waterproof/283870921777?hash=item4218068431:g:R3AAAOSw12NeeoDY
"NEW Stio 1327 CFS Womens Thermal Pond Shirt Button Up Size XL Green Teal $115", eBay, $64.77, Sold: May-9, XLarge, https://www.ebay.com/itm/NEW-Stio-1327-CFS-Womens-Thermal-Pond-Shirt-Button-Up-Size-XL-Green-Teal-115/264460028224?hash=item3d930bc940:g:I5EAAOSwCjdddy46
"Womens Stio Brown Corduroy Pants 8", eBay, $29.99, Sold: May-8, Unknown, https://www.ebay.com/itm/Womens-Stio-Brown-Corduroy-Pants-8/184280583063?hash=item2ae7fa8b97:g:Q8EAAOSw~cResb6a
"2019 Topps Allen & Ginter Non-Baseball Player Base Inserts Star Signs U Pick", eBay, $0.99 to $2.50, Sold: May-7, Unknown, https://www.ebay.com/itm/2019-Topps-Allen-Ginter-Non-Baseball-Player-Base-Inserts-Star-Signs-U-Pick/352878636953?hash=item522934af99:g:4ZEAAOSwkJJdWWKi
"Stio Men’s Corduroy Long Sleeve Jacket Size Medium Green", eBay, $27.99, Sold: May-7, Medium, https://www.ebay.com/itm/Stio-Men-s-Corduroy-Long-Sleeve-Jacket-Size-Medium-Green/193444805916?hash=item2d0a357d1c:g:OzMAAOSwmaBeq0C7
"Stio Rivet Jean size 36 x 32 very comfortable. Jackson WY. No Reserve", eBay, $15.00, Sold: May-7, Unknown, https://www.ebay.com/itm/Stio-Rivet-Jean-size-36-x-32-very-comfortable-Jackson-WY-No-Reserve/202979235999?hash=item2f4281589f:g:DtcAAOSwTlVeoa7v
"Cloudveil Short Sleeve Shirt Button Front Women's S Small Stio", eBay, $22.00, Sold: May-6, Small, https://www.ebay.com/itm/Cloudveil-Short-Sleeve-Shirt-Button-Front-Womens-S-Small-Stio/163933577429?hash=item262b33e0d5:g:bacAAOSwNtldwzZ2
"Cloudveil Short Sleeve Shirt Button Front Women's S Small Stio", eBay, $19.00, Sold: May-6, Small, https://www.ebay.com/itm/Cloudveil-Short-Sleeve-Shirt-Button-Front-Womens-S-Small-Stio/163933674258?hash=item262b355b12:g:qRUAAOSwERFdw0JK
"Stio Jackson Hole Womens Divide Shirt Roll Tab Sleeve Small Aqua", eBay, $14.99, Sold: May-6, Small, https://www.ebay.com/itm/Stio-Jackson-Hole-Womens-Divide-Shirt-Roll-Tab-Sleeve-Small-Aqua/274357314641?hash=item3fe0f86451:g:HSkAAOSwM1deshqA
"Stio Jackson Hole Womens Divide Shirt Roll Tab Sleeve Small Slate", eBay, $14.99, Sold: May-6, Small, https://www.ebay.com/itm/Stio-Jackson-Hole-Womens-Divide-Shirt-Roll-Tab-Sleeve-Small-Slate/283869106017?hash=item4217eacf61:g:~nYAAOSwmjZeshzI
"New Stio Hooded Pullover Divide Thermal Pond Teal Men's - XLarge - $85", eBay, $39.00, Sold: May-6, Large, https://www.ebay.com/itm/New-Stio-Hooded-Pullover-Divide-Thermal-Pond-Teal-Mens-XLarge-85/164072269990?hash=item26337828a6:g:nfEAAOSwAl5ePi~I
"STIO ~ WOMENS MEDIUM ~ GRAY FULL ZIP DOWN PUFFER VEST ~ JACKSON HOLE", eBay, $75.99, Sold: May-4, Medium, https://www.ebay.com/itm/STIO-WOMENS-MEDIUM-GRAY-FULL-ZIP-DOWN-PUFFER-VEST-JACKSON-HOLE/283842186245?hash=item4216500c05:g:nd0AAOSwPf1ejzTp
"Stio Mens Size Large Short Sleeve Divide Polo Shirt Gray", eBay, $18.00, Sold: May-3, Large, https://www.ebay.com/itm/Stio-Mens-Size-Large-Short-Sleeve-Divide-Polo-Shirt-Gray/293485097559?hash=item4455133257:g:BpwAAOSwhEteTgCo
"NEW Stio Mens's Medium 32 CFS Board Pants", eBay, $50.00, Sold: May-3, Medium, https://www.ebay.com/itm/NEW-Stio-Menss-Medium-32-CFS-Board-Pants/223991188845?hash=item3426ea4d6d:g:vRoAAOSwae9epv4d
"NWT Stio Skycrest Insulated Snap Shirt Packable Insulated Jacket  Quiet Gray  L", eBay, $89.99, Sold: May-2, Unknown, https://www.ebay.com/itm/NWT-Stio-Skycrest-Insulated-Snap-Shirt-Packable-Insulated-Jacket-Quiet-Gray-L/193445955317?hash=item2d0a4706f5:g:Pc8AAOSweQFerCph
"Stio Blue Turtleneck Fleece Sweater Blue Size Small S Thumbholes Lightweight", eBay, $37.99, Sold: May-2, Small, https://www.ebay.com/itm/Stio-Blue-Turtleneck-Fleece-Sweater-Blue-Size-Small-S-Thumbholes-Lightweight/254582329044?hash=item3b464a0ed4:g:~I4AAOSwnSBeogyw
"NWT Stio Water Repellent Primaloft Insulated Azura XT Hooded Jacket  Gray  Sz S", eBay, $109.99, Sold: May-2, Unknown, https://www.ebay.com/itm/NWT-Stio-Water-Repellent-Primaloft-Insulated-Azura-XT-Hooded-Jacket-Gray-Sz-S/193445861645?hash=item2d0a45990d:g:9MMAAOSwCdRerCZq
"Stio S NWT $79.00 Women's CFS 50+ Sun Protection Trunk Shorts Blue", eBay, $33.00, Sold: May-1, Unknown, https://www.ebay.com/itm/Stio-S-NWT-79-00-Womens-CFS-50-Sun-Protection-Trunk-Shorts-Blue/174244540486?hash=item2891c8b046:g:BmgAAOSwNeFejRmX
"Stio Environ Men's Ski Pant 2152 Color Tap Shoe (Black) Size XL NEW with tags", eBay, $129.00, Sold: May-1, XLarge, https://www.ebay.com/itm/Stio-Environ-Mens-Ski-Pant-2152-Color-Tap-Shoe-Black-Size-XL-NEW-with-tags/124123427457?hash=item1ce6553281:g:TRkAAOSwUdZec55M
"CV Axle Joint Assembly Front Pair fit Saturn Ion Sedan Manual Trans 2.2L 03-07", eBay, $102.33, Sold: May-1, XLarge, https://www.ebay.com/itm/CV-Axle-Joint-Assembly-Front-Pair-fit-Saturn-Ion-Sedan-Manual-Trans-2-2L-03-07/132954409081?epid=2184988364&hash=item1ef4b34879:g:IJkAAOSwOKlcZule
"Stio mens second light jacket - size Large - color green", eBay, $50.00, Sold: Apr-30, Large, https://www.ebay.com/itm/Stio-mens-second-light-jacket-size-Large-color-green/383519510262?hash=item594b8b4ef6:g:YOcAAOSwZJRem3qP
"STIO Ralston Canvas Jacket Mens Size Large EUC heavy Shirt", eBay, $52.49, Sold: Apr-30, Large, https://www.ebay.com/itm/STIO-Ralston-Canvas-Jacket-Mens-Size-Large-EUC-heavy-Shirt/283850791311?hash=item4216d3598f:g:gdkAAOSwAkZeeSRp
"2019 Topps Allen and Ginter #156 Vincent Stio", eBay, $0.80, Sold: Apr-29, Unknown, https://www.ebay.com/itm/2019-Topps-Allen-and-Ginter-156-Vincent-Stio/223986381280?hash=item3426a0f1e0:g:~jEAAOSwhBFdm-xz
"Stio Sweetwater Fleece Cowl Neck Sweater Burnt Orange Small S", eBay, $24.99, Sold: Apr-29, Small, https://www.ebay.com/itm/Stio-Sweetwater-Fleece-Cowl-Neck-Sweater-Burnt-Orange-Small-S/193431584155?hash=item2d096bbd9b:g:~8IAAOSw7mhenebL
"Stio Mens Titanium Premium Down Hooded Vest Sz. Small", eBay, $90.00, Sold: Apr-29, Small, https://www.ebay.com/itm/Stio-Mens-Titanium-Premium-Down-Hooded-Vest-Sz-Small/164176554611?hash=item2639af6a73:g:xHgAAOSwUCBepuf4
"Stio Mens Environ Jacket  Large  Mountain Shadow", eBay, $150.00, Sold: Apr-28, Large, https://www.ebay.com/itm/Stio-Mens-Environ-Jacket-Large-Mountain-Shadow/353064005748?hash=item5234413074:g:qB0AAOSw32VeqOeL
"new STIO men 2125 M's sweater synthis zip 10% wool piquant green L MSRP $119", eBay, $48.99, Sold: Apr-28, Unknown, https://www.ebay.com/itm/new-STIO-men-2125-Ms-sweater-synthis-zip-10-wool-piquant-green-L-MSRP-119/333137541023?hash=item4d908b779f:g:blAAAOSw2k9coE2g
"Kids' Stio Thermop Fleece Snap Neck Pullover Lot Size 4 and 6 Boys base layer", eBay, $12.00 $23.00, Sold: Apr-28, Unknown, https://www.ebay.com/itm/Kids-Stio-Thermop-Fleece-Snap-Neck-Pullover-Lot-Size-4-and-6-Boys-base-layer/223987219909?hash=item3426adbdc5:g:fpEAAOSwiFBeofFc
"Stio Mens Hometown Down Hoodie jacket Black EUC MSRP $299 Medium M", eBay, $150.00, Sold: Apr-27, Medium, https://www.ebay.com/itm/Stio-Mens-Hometown-Down-Hoodie-jacket-Black-EUC-MSRP-299-Medium-M/202976113854?hash=item2f4251b4be:g:8VMAAOSwBORepdNr
"Stio Mens Medium Blue Short Sleeve Western Snap Down Shirt", eBay, $49.99, Sold: Apr-26, Medium, https://www.ebay.com/itm/Stio-Mens-Medium-Blue-Short-Sleeve-Western-Snap-Down-Shirt/202969837514?hash=item2f41f1efca:g:ctMAAOSwvchdrH1k
"STIO 1170 W. Skycrest Insulated Snap Shirt jacket Women's Gray  $179  NWT XL", eBay, $121.99, Sold: Apr-26, XLarge, https://www.ebay.com/itm/STIO-1170-W-Skycrest-Insulated-Snap-Shirt-jacket-Womens-Gray-179-NWT-XL/264590557400?epid=12036260312&hash=item3d9ad380d8:g:WLQAAOSwJ4peDkfG
"New Stio Hooded Pullover Divide Thermal Pond Yam Men's - Large - $85", eBay, $39.00, Sold: Apr-26, Large, https://www.ebay.com/itm/New-Stio-Hooded-Pullover-Divide-Thermal-Pond-Yam-Mens-Large-85/164097545292?hash=item2634f9d44c:g:-aUAAOSwXVBeVe-B
"Stio Mens Large Topographic Hoodie Athletic Heather", eBay, $38.00, Sold: Apr-26, Large, https://www.ebay.com/itm/Stio-Mens-Large-Topographic-Hoodie-Athletic-Heather/402245525206?hash=item5da7b39ed6:g:up8AAOSwuJpepa~B
"Stio Men's Canvas Hiking Pants - Outdoor Gear Color - Olive Green Size 33 x 34", eBay, $40.00, Sold: Apr-25, Unknown, https://www.ebay.com/itm/Stio-Mens-Canvas-Hiking-Pants-Outdoor-Gear-Color-Olive-Green-Size-33-x-34/114129621932?hash=item1a92a7d3ac:g:EVQAAOSwveheVSbp
"Stio Popover Shirt Cotton Tencel Outdoors Small Cora Chambray 23501", eBay, $29.00, Sold: Apr-25, Small, https://www.ebay.com/itm/Stio-Popover-Shirt-Cotton-Tencel-Outdoors-Small-Cora-Chambray-23501/233567508837?hash=item3661b55965:g:yDAAAOSw-uFedLT8
"Stio Outdoor Casual flannel Shirt size XL Men soft cotton Long sleeve", eBay, $25.00, Sold: Apr-22, XLarge, https://www.ebay.com/itm/Stio-Outdoor-Casual-flannel-Shirt-size-XL-Men-soft-cotton-Long-sleeve/333536936162?hash=item4da859c0e2:g:tmYAAOSwjLxeYelu
"Stio Ralston Canvas Jacket Mens XL", eBay, $55.00, Sold: Apr-22, XLarge, https://www.ebay.com/itm/Stio-Ralston-Canvas-Jacket-Mens-XL/283851845293?hash=item4216e36ead:g:ukcAAOSw5HZemxjx
"NWT Stio Skyrider Ski Coat XL Dark Gray Winter Puffer", eBay, $59.99, Sold: Apr-22, XLarge, https://www.ebay.com/itm/NWT-Stio-Skyrider-Ski-Coat-XL-Dark-Gray-Winter-Puffer/143583378926?hash=item216e3c7dee:g:f0AAAOSwebVemnZV
"Stio Environ Men's Ski Pant Mountain Shadow Size Medium NEW with tags", eBay, $240.00, Sold: Apr-22, Medium, https://www.ebay.com/itm/Stio-Environ-Mens-Ski-Pant-Mountain-Shadow-Size-Medium-NEW-with-tags/303546866369?hash=item46accd9ac1:g:25oAAOSwWu5emJ8M
"Stio Mens Active Pants Tan Size 36", eBay, $23.00, Sold: Apr-21, Unknown, https://www.ebay.com/itm/Stio-Mens-Active-Pants-Tan-Size-36/333579648833?hash=item4daae57f41:g:9BgAAOSw2j5enRX4
"Two Men’s XL Puffy Vests Patagonia & Stio", eBay, $112.50, Sold: Apr-21, XLarge, https://www.ebay.com/itm/Two-Men-s-XL-Puffy-Vests-Patagonia-Stio/153894955122?hash=item23d4daa872:g:gK0AAOSwJcdekhYL
"Stio Mens XXL 2XL 1/2 Snap Button Fleece Pullover Jacket Mock Neck Burnt Orange", eBay, $39.95, Sold: Apr-21, XLarge, https://www.ebay.com/itm/Stio-Mens-XXL-2XL-1-2-Snap-Button-Fleece-Pullover-Jacket-Mock-Neck-Burnt-Orange/164138885578?hash=item263770a1ca:g:1-0AAOSwARhefAZe
"Stio Modis Men's Large Full Zip Hooded Outdoor Jacket Black NWOT Rare Colorway", eBay, $60.00, Sold: Apr-20, Large, https://www.ebay.com/itm/Stio-Modis-Mens-Large-Full-Zip-Hooded-Outdoor-Jacket-Black-NWOT-Rare-Colorway/362969904239?hash=item5482b1346f:g:s3oAAOSwvLtelUSr
"NWT Stio Womens Poplar Button Up - Skyscape Plaid - Large", eBay, $49.00, Sold: Apr-20, Large, https://www.ebay.com/itm/NWT-Stio-Womens-Poplar-Button-Up-Skyscape-Plaid-Large/163882119180?hash=item262822b00c:g:cNIAAOSw1ExdiP2I
"Stio Environ Men's Ski Pant 2152 Color Vert Size XL NEW with tags", eBay, $119.00, Sold: Apr-20, XLarge, https://www.ebay.com/itm/Stio-Environ-Mens-Ski-Pant-2152-Color-Vert-Size-XL-NEW-with-tags/124123428114?hash=item1ce6553512:g:XIYAAOSwNvBec6AB
"Stio Men's Pullover Shirt Half Zip Long Sleeve Performance Gray XL", eBay, $19.00, Sold: Apr-19, XLarge, https://www.ebay.com/itm/Stio-Mens-Pullover-Shirt-Half-Zip-Long-Sleeve-Performance-Gray-XL/333579500629?hash=item4daae33c55:g:fCkAAOSwX~henNPi
"NWOT Stio Divide shirt women's medium color black", eBay, $24.00, Sold: Apr-19, Medium, https://www.ebay.com/itm/NWOT-Stio-Divide-shirt-womens-medium-color-black/254573089982?hash=item3b45bd14be:g:t-kAAOSwn4Bem0Ro
"NEW Women's Stio Rune Hooded Sweater - Gray - Small", eBay, $65.00, Sold: Apr-19, Small, https://www.ebay.com/itm/NEW-Womens-Stio-Rune-Hooded-Sweater-Gray-Small/333575109878?hash=item4daaa03cf6:g:2twAAOSwJVxelfwF
"STIO Jacket Quilted Puffer Microlight Lightweight Ski Coat Blue Men’s XL", eBay, $35.00, Sold: Apr-17, XLarge, https://www.ebay.com/itm/STIO-Jacket-Quilted-Puffer-Microlight-Lightweight-Ski-Coat-Blue-Men-s-XL/362969908192?hash=item5482b143e0:g:4TQAAOSw7hRelUfL
"Stio Green Pants Size 2 Womens", eBay, $11.99, Sold: Apr-17, Unknown, https://www.ebay.com/itm/Stio-Green-Pants-Size-2-Womens/223980082441?hash=item342640d509:g:WHMAAOSwbLpemSG7
"Stio Women's Alpha Alpine 1/4 Button Pullover  XL NWOT", eBay, $50.00, Sold: Apr-16, XLarge, https://www.ebay.com/itm/Stio-Womens-Alpha-Alpine-1-4-Button-Pullover-XL-NWOT/283844529777?hash=item421673ce71:g:uKoAAOSwgspd5ffn
"Stio Women’s Second Light Pullover  PreOwned  Castlerock  XL", eBay, $30.00, Sold: Apr-16, XLarge, https://www.ebay.com/itm/Stio-Women-s-Second-Light-Pullover-PreOwned-Castlerock-XL/283844682559?hash=item421676233f:g:Lo4AAOSwGmtekp89
"Stio Green Speckled Insulated Sweatshirt V-neck Men's Size XXL Pocket", eBay, $67.49, Sold: Apr-16, XLarge, https://www.ebay.com/itm/Stio-Green-Speckled-Insulated-Sweatshirt-V-neck-Mens-Size-XXL-Pocket/402031418247?hash=item5d9af09b87:g:3dIAAOSw8UZeF0ce
"Men's Stio Hometown Down Hooded Jacket NWT( Size L ) Tapshoe Black", eBay, $295.00, Sold: Apr-16, Unknown, https://www.ebay.com/itm/Mens-Stio-Hometown-Down-Hooded-Jacket-NWT-Size-L-Tapshoe-Black/362957616292?hash=item5481f5b4a4:g:ArMAAOSw2T9ef~4b
"Stio Womens Size XL Shirt Snap Front Blue Plaid Nylon Polyester Style #1020", eBay, $34.95, Sold: Apr-15, XLarge, https://www.ebay.com/itm/Stio-Womens-Size-XL-Shirt-Snap-Front-Blue-Plaid-Nylon-Polyester-Style-1020/174166202020?hash=item288d1d56a4:g:RI8AAOSwGTheKNa5
"Stio Mountain Mens Green Full Zip Jacket Size XL", eBay, $85.00, Sold: Apr-15, XLarge, https://www.ebay.com/itm/Stio-Mountain-Mens-Green-Full-Zip-Jacket-Size-XL/114178308866?hash=item1a958ebb02:g:RewAAOSw9Etejhjk
"Sold Out Stio NWOT Women Pinedale Pant Sz 10 Elmwood Khaki Tan Hiking Pants $159", eBay, $119.99, Sold: Apr-15, Unknown, https://www.ebay.com/itm/Sold-Out-Stio-NWOT-Women-Pinedale-Pant-Sz-10-Elmwood-Khaki-Tan-Hiking-Pants-159/324129781718?hash=item4b77a3f7d6:g:j6wAAOSwaLxeXEoW
"Stio Hiking Pants Size 12 Womens Grey", eBay, $32.99, Sold: Apr-15, Unknown, https://www.ebay.com/itm/Stio-Hiking-Pants-Size-12-Womens-Grey/223977562781?hash=item34261a629d:g:OHkAAOSwZdteliYV
"Stio Hiking Pants Size 12 Womens Black", eBay, $32.99, Sold: Apr-15, Unknown, https://www.ebay.com/itm/Stio-Hiking-Pants-Size-12-Womens-Black/223977566285?hash=item34261a704d:g:ywUAAOSw~t5elieg
"Youth Kids STIO Size 10 Windbreaker Jacket Neon Yellow Green", eBay, $30.59, Sold: Apr-14, Unknown, https://www.ebay.com/itm/Youth-Kids-STIO-Size-10-Windbreaker-Jacket-Neon-Yellow-Green/324057751497?hash=item4b7358dfc9:g:pMgAAOSw-IheMPbL
"Women's STIO Pants Coburn Jogger Size 12 blue/gray color", eBay, $50.00, Sold: Apr-14, Unknown, https://www.ebay.com/itm/Womens-STIO-Pants-Coburn-Jogger-Size-12-blue-gray-color/333442187549?hash=item4da2b4011d:g:LW0AAOSwBYpd-ZnF
"Stio Womens XLarge DIvide Tee LS Polished Ice Heather", eBay, $21.50 $45.00, Sold: Apr-14, Large, https://www.ebay.com/itm/Stio-Womens-XLarge-DIvide-Tee-LS-Polished-Ice-Heather/223970651389?hash=item3425b0ecfd:g:LXkAAOSwxW9ejPEl
"Stio Mens Quilted Down Jacket Size Small Blue", eBay, $89.99, Sold: Apr-14, Small, https://www.ebay.com/itm/Stio-Mens-Quilted-Down-Jacket-Size-Small-Blue/293496190869?hash=item4455bc7795:g:HrIAAOSwMmheWof0
"Stio Red Kita fleece jacket-women’s Medium", eBay, $50.00, Sold: Apr-13, Medium, https://www.ebay.com/itm/Stio-Red-Kita-fleece-jacket-women-s-Medium/143579740890?hash=item216e04fada:g:gjEAAOSwXbZelKp0
"Stio Rune Crew Neck Wool Sweater Women's Size Medium", eBay, $60.00, Sold: Apr-13, Medium, https://www.ebay.com/itm/Stio-Rune-Crew-Neck-Wool-Sweater-Womens-Size-Medium/174159676382?hash=item288cb9c3de:g:5uQAAOSwt-heIkdR
"Stio Blue Army Fatigue Adjustable Trucker Cap Hat", eBay, $13.64, Sold: Apr-13, Unknown, https://www.ebay.com/itm/Stio-Blue-Army-Fatigue-Adjustable-Trucker-Cap-Hat/254493535065?hash=item3b40ff2b59:g:610AAOSw8LZeLbl2
"Stio Stillwater Supply Co. Men's Rambler Reversible Blue Plaid Jacket Medium EUC", eBay, $51.99, Sold: Apr-12, Medium, https://www.ebay.com/itm/Stio-Stillwater-Supply-Co-Mens-Rambler-Reversible-Blue-Plaid-Jacket-Medium-EUC/233519827330?hash=item365eddc982:g:ED4AAOSwWkFeZacE
"STIO NWT Women's CFS Board Short Sundance Floral size 4 $89", eBay, $11.75 $45.00, Sold: Apr-12, Unknown, https://www.ebay.com/itm/STIO-NWT-Womens-CFS-Board-Short-Sundance-Floral-size-4-89/133380275958?hash=item1f0e157ef6:g:p6kAAOSwCeFeios0
"Stio Womens Slim Pants Size 2 Gray", eBay, $12.99, Sold: Apr-12, Unknown, https://www.ebay.com/itm/Stio-Womens-Slim-Pants-Size-2-Gray/123342650415?hash=item1cb7cb7c2f:g:JJgAAOSwM85bfaAI
"Stio  Women's Pants  Sz 8  Beige  Nylon/Spandex Blend  Mint Condition ", eBay, $35.00, Sold: Apr-12, Unknown, https://www.ebay.com/itm/Stio-Womens-Pants-Sz-8-Beige-Nylon-Spandex-Blend-Mint-Condition/133376135141?hash=item1f0dd64fe5:g:QsIAAOSwf15adwp8
"Women STIO Jackson Hole  Wyoming 1/2 Zip Thermore Jacket Pullover Large", eBay, $49.99, Sold: Apr-12, Large, https://www.ebay.com/itm/Women-STIO-Jackson-Hole-Wyoming-1-2-Zip-Thermore-Jacket-Pullover-Large/223948974538?hash=item34246629ca:g:oZcAAOSwygFecDmn
"Stio Men’s Divide Hooded Pullover Burnt Orange Size Small", eBay, $30.00, Sold: Apr-11, Small, https://www.ebay.com/itm/Stio-Men-s-Divide-Hooded-Pullover-Burnt-Orange-Size-Small/183995190334?hash=item2ad6f7cc3e:g:KskAAOSwYoZdpMJA
"2019 Allen & Ginter Non-Baseball Lot / Stio Jaenson Rocks !!", eBay, $0.72, Sold: Apr-11, Unknown, https://www.ebay.com/itm/2019-Allen-Ginter-Non-Baseball-Lot-Stio-Jaenson-Rocks/274327780271?hash=item3fdf35bbaf:g:BlYAAOSwoSxef8HD
"STIO Men's Blue Long Sleeve Large L Pearl Snap Button Shirt Western", eBay, $46.99, Sold: Apr-11, Large, https://www.ebay.com/itm/STIO-Mens-Blue-Long-Sleeve-Large-L-Pearl-Snap-Button-Shirt-Western/114148609658?hash=item1a93c98e7a:g:A60AAOSwIM5ebKKp
"Nwt Stio Men’s Gannett Peak Half Zip (Atlantic Deep) - XXLarge - retail $129", eBay, $79.00, Sold: Apr-10, Large, https://www.ebay.com/itm/Nwt-Stio-Men-s-Gannett-Peak-Half-Zip-Atlantic-Deep-XXLarge-retail-129/164004145579?hash=item262f68a9ab:g:sNMAAOSw99ReAwi~
"Stio Men's Mesh-Lined Second Light Drawstring Shorts MC7 Magnet Camo Size XL NWT", eBay, $33.74, Sold: Apr-9, XLarge, https://www.ebay.com/itm/Stio-Mens-Mesh-Lined-Second-Light-Drawstring-Shorts-MC7-Magnet-Camo-Size-XL-NWT/293316990070?hash=item444b0e1476:g:NCcAAOSwxkpdwzmn
"STIO Men's Sz XL Pearl Snap Blue Chambray Rayon Rockabilly Hiking Shirt", eBay, $34.99, Sold: Apr-9, XLarge, https://www.ebay.com/itm/STIO-Mens-Sz-XL-Pearl-Snap-Blue-Chambray-Rayon-Rockabilly-Hiking-Shirt/193414151085?hash=item2d0861bbad:g:WXoAAOSw-AFejJG6
"Stio Men's Medium Azura Insulated Full Zip Jacket  Black - Brand New with Tags", eBay, $62.00, Sold: Apr-9, Medium, https://www.ebay.com/itm/Stio-Mens-Medium-Azura-Insulated-Full-Zip-Jacket-Black-Brand-New-with-Tags/333564857899?hash=item4daa03ce2b:g:gkkAAOSwqmVec9AX
"Stio Men’s XL Hometown Down Hooded Vest Orion Blue Brand NEW w/ Tags", eBay, $206.89, Sold: Apr-8, XLarge, https://www.ebay.com/itm/Stio-Men-s-XL-Hometown-Down-Hooded-Vest-Orion-Blue-Brand-NEW-w-Tags/233518600150?hash=item365ecb0fd6:g:UBgAAOSwf6heEjg2
"Stio Wilcox Full Zip Fleece Jacket Men's Size Medium", eBay, $38.00, Sold: Apr-8, Medium, https://www.ebay.com/itm/Stio-Wilcox-Full-Zip-Fleece-Jacket-Mens-Size-Medium/184245149024?hash=item2ae5dddd60:g:agwAAOSwIYtejk4v
"2019 Topps Allen And Ginter Vincent Stio Lot X5 Gold Border And Mini SP", eBay, $5.99, Sold: Apr-8, Unknown, https://www.ebay.com/itm/2019-Topps-Allen-And-Ginter-Vincent-Stio-Lot-X5-Gold-Border-And-Mini-SP/223601761292?hash=item340fb41c0c:g:5jUAAOSwQ9ldO64A
"Stio Wilcox Mens XL Hoodie", eBay, $70.00, Sold: Apr-7, XLarge, https://www.ebay.com/itm/Stio-Wilcox-Mens-XL-Hoodie/283838369608?hash=item421615cf48:g:M24AAOSwq9Zeiij0
"2019 Topps Allen & Ginter Vincent Stio Card #156 Umpire Fan", eBay, $1.00, Sold: Apr-7, Unknown, https://www.ebay.com/itm/2019-Topps-Allen-Ginter-Vincent-Stio-Card-156-Umpire-Fan/193042234137?hash=item2cf236bb19:g:i-YAAOSw9TFdT2tr
"Men's STIO Skier Shirt Size Large", eBay, $29.00, Sold: Apr-6, Large, https://www.ebay.com/itm/Mens-STIO-Skier-Shirt-Size-Large/184142285093?hash=item2adfbc4925:g:DfgAAOSwWSVeKeap
"Stio Mountain Pants Size 2 Women's Black Skinny Zip Pockets Hiking Softshell", eBay, $33.99, Sold: Apr-5, Unknown, https://www.ebay.com/itm/Stio-Mountain-Pants-Size-2-Womens-Black-Skinny-Zip-Pockets-Hiking-Softshell/254546126260?hash=item3b4421a5b4:g:jZUAAOSwC7NedMe~
"NWT Stio Second Light Pullover Women's  Castlerock  size Medium  retail $99", eBay, $49.00, Sold: Apr-5, Medium, https://www.ebay.com/itm/NWT-Stio-Second-Light-Pullover-Womens-Castlerock-size-Medium-retail-99/163995900135?hash=item262eead8e7:g:kJ0AAOSw5Pld-v9m
"Stio Women's Pinedale Pant Black  Size 8", eBay, $32.00 $80.00, Sold: Apr-5, Unknown, https://www.ebay.com/itm/Stio-Womens-Pinedale-Pant-Black-Size-8/143567425635?hash=item216d491063:g:HfMAAOSwoctegMDn
"Stio Miter Flannel Mens Large Blue Gray Plaid Pocket Long Sleeve Button Shirt", eBay, $29.88, Sold: Apr-4, Large, https://www.ebay.com/itm/Stio-Miter-Flannel-Mens-Large-Blue-Gray-Plaid-Pocket-Long-Sleeve-Button-Shirt/133379123719?hash=item1f0e03ea07:g:ZbMAAOSwv-5eiMhj
"Stio Chambray Popover Shirt Cotton Tencel Outdoors Medium", eBay, $29.00, Sold: Apr-4, Medium, https://www.ebay.com/itm/Stio-Chambray-Popover-Shirt-Cotton-Tencel-Outdoors-Medium/233539425619?hash=item366008d553:g:CHoAAOSw~q5edD0f
"Stio Women's Sweetwater Fleece 1/4 Zip Blue Size Medium", eBay, $49.99, Sold: Apr-4, Medium, https://www.ebay.com/itm/Stio-Womens-Sweetwater-Fleece-1-4-Zip-Blue-Size-Medium/124105292184?hash=item1ce5407998:g:xOQAAOSwD-5eXmOq
"Stio Shot 7 Down Jacket - Men’s Large", eBay, $250.00, Sold: Apr-3, Large, https://www.ebay.com/itm/Stio-Shot-7-Down-Jacket-Men-s-Large/303518095642?hash=item46ab16991a:g:ffQAAOSwxrBecns1
"Stio Men's Snap Button Eddy Shirt LS KB8 Evergreen Check Medium NWT $129", eBay, $74.99, Sold: Apr-2, Medium, https://www.ebay.com/itm/Stio-Mens-Snap-Button-Eddy-Shirt-LS-KB8-Evergreen-Check-Medium-NWT-129/303523492688?hash=item46ab68f350:g:-1sAAOSw7Wxee2IQ
"Stio Sweetwater Fleece hoodie Rooibos red size small Women's", eBay, $26.53, Sold: Apr-1, Small, https://www.ebay.com/itm/Stio-Sweetwater-Fleece-hoodie-Rooibos-red-size-small-Womens/133368652172?hash=item1f0d64218c:g:CKYAAOSwJIteeCAE
"STIO Ralston Canvas Jacket Mens Size Large EUC heavy Shirt", eBay, $48.99, Sold: Apr-1, Large, https://www.ebay.com/itm/STIO-Ralston-Canvas-Jacket-Mens-Size-Large-EUC-heavy-Shirt/283825152625?hash=item42154c2271:g:gdkAAOSwAkZeeSRp
"STIO Lightweight Outdoor Blue Pants Size 32", eBay, $35.00, Sold: Apr-1, Unknown, https://www.ebay.com/itm/STIO-Lightweight-Outdoor-Blue-Pants-Size-32/223962904071?hash=item34253ab607:g:mOYAAOSwsddeg6N0
