"title", source, price, sold, size, url
  EBAY AVAILABLE STATS for Brand: stio   Items Scanned: 360   Total Items (Including sponsored): 374   Value (Without sponsored): $16874.25 
  EBAY SOLD STATS for Brand: stio   Total Sold Items: 290   Value: $14716.15 
  POSHMARK AVAILABLE STATS for Brand: stio   Items Scanned: 114   Total Value: $7881.00 
  POSHMARK SOLD STATS for Brand: stio   Items Scanned: 622   Total Value: $31697.00 
  THREDUP AVAILABLE STATS for Brand: stio   Items Scanned: 12   Value (Without sponsored): $233.88 
  Number of xsmall  small  medium  large  xlarge  unknown: 59  233  266  195  105  540
  TOTAL VALUE OF AVAILABLE AND SOLD ITEMS ON ALL SITES: $71402.27627777774
"STIO Jackson Hole 2017 Solar Eclipse commemorative Trucker's Hat Cap New! Rare!", eBay, $20.00, Available, Unknown, https://www.ebay.com/itm/STIO-Jackson-Hole-2017-Solar-Eclipse-commemorative-Truckers-Hat-Cap-New-Rare/254638526710?hash=item3b49a390f6:g:smcAAOSwCxBe-YHz
"NWT Stio Sweetwater Fleece Full Zip Sweater Poncho Jacket Sweater Gray M/L $179", eBay, $39.99, Available, Unknown, https://www.ebay.com/itm/NWT-Stio-Sweetwater-Fleece-Full-Zip-Sweater-Poncho-Jacket-Sweater-Gray-M-L-179/114281386264?hash=item1a9bb39118:g:D84AAOSwTx1exxhH
"2019 Topps Allen & Ginter Vincent Stio Card #156 Umpire Fan", eBay, $1.00, Available, Unknown, https://www.ebay.com/itm/2019-Topps-Allen-Ginter-Vincent-Stio-Card-156-Umpire-Fan/153987083846?hash=item23da586e46:g:i8QAAOSw4YZe-Re-
"Women's STIO Down Vest  Size S  Free Ship", eBay, $63.00, Available, Unknown, https://www.ebay.com/itm/Womens-STIO-Down-Vest-Size-S-Free-Ship/224061266283?hash=item342b17996b:g:4ZgAAOSwiYleXZ40
"Stio NWT Mens XL Brilliant Blue Polyester Long Sleeve Hiking Button Front Shirt", eBay, $44.99, Available, XLarge, https://www.ebay.com/itm/Stio-NWT-Mens-XL-Brilliant-Blue-Polyester-Long-Sleeve-Hiking-Button-Front-Shirt/224060945546?hash=item342b12b48a:g:ekAAAOSwnXde-LCE
"Stio Ladies Pants Size 8", eBay, $15.99, Available, Unknown, https://www.ebay.com/itm/Stio-Ladies-Pants-Size-8/184344512201?hash=item2aebca06c9:g:n9UAAOSwgopeynXA
"Stio NWT Women's XS 1160 W's Hometown down coat Gray/Silver w/Blue lining", eBay, $144.00, Available, Xsmall, https://www.ebay.com/itm/Stio-NWT-Womens-XS-1160-Ws-Hometown-down-coat-Gray-Silver-w-Blue-lining/283930018270?hash=item421b8c41de:g:S60AAOSw0NZeOy~1
"Stio Women's Rivet Cord 6", eBay, $18.00, Available, Unknown, https://www.ebay.com/itm/Stio-Womens-Rivet-Cord-6/143643441871?hash=item2171d0facf:g:zSwAAOSwkZlevrWH
"Stio Womens Poplar Shirt Medium Blue Plaid Button Up Linen Blend Jackson Hole WY", eBay, $29.99, Available, Medium, https://www.ebay.com/itm/Stio-Womens-Poplar-Shirt-Medium-Blue-Plaid-Button-Up-Linen-Blend-Jackson-Hole-WY/293629468369?hash=item445dae1ed1:g:2F8AAOSwhmle48At
"Mens STIO tshirt Large EUC Gray Short Sleeve Mountain Company", eBay, $16.99, Available, Large, https://www.ebay.com/itm/Mens-STIO-tshirt-Large-EUC-Gray-Short-Sleeve-Mountain-Company/174330724546?hash=item2896ebc0c2:g:Ft4AAOSwjMJe95oQ
"Stio Men's Pinedale Pant Size 40", eBay, $100.00, Available, Unknown, https://www.ebay.com/itm/Stio-Mens-Pinedale-Pant-Size-40/392853975502?hash=item5b77ebf1ce:g:eHUAAOSwrIRe93g0
"Men's Stio Long Sleeve 1/2 Zip Sweater  Size Large Dark Gray. /L", eBay, $45.00, Available, Large, https://www.ebay.com/itm/Mens-Stio-Long-Sleeve-1-2-Zip-Sweater-Size-Large-Dark-Gray-L/303607364696?hash=item46b068bc58:g:e38AAOSwPhFe9u33
"2019 Allen and Ginter Gold SP Foil #156 Vincent Stio Umpire Fan", eBay, $1.00, Available, Unknown, https://www.ebay.com/itm/2019-Allen-and-Ginter-Gold-SP-Foil-156-Vincent-Stio-Umpire-Fan/114278131317?hash=item1a9b81e675:g:Ku4AAOSwxZteq6r-
"Stio Women's Gray Sweetwater Fleece Jacket Size Large GORGEOUS NWOT", eBay, $69.95, Available, Large, https://www.ebay.com/itm/Stio-Womens-Gray-Sweetwater-Fleece-Jacket-Size-Large-GORGEOUS-NWOT/333636906668?hash=item4dae4f2eac:g:SFgAAOSwkWRe9qzN
"Stio Athletic Jacket Women’s xs Black Neon Green Zipper", eBay, $19.99, Available, Xsmall, https://www.ebay.com/itm/Stio-Athletic-Jacket-Women-s-xs-Black-Neon-Green-Zipper/153984995294?hash=item23da388fde:g:5bUAAOSwzYVe9qtc
"2019 Topps Allen and Ginter Mini #156 Vincent Stio Umpire Fan", eBay, $1.69, Available, Unknown, https://www.ebay.com/itm/2019-Topps-Allen-and-Ginter-Mini-156-Vincent-Stio-Umpire-Fan/353119429005?hash=item52378ee18d:g:JIkAAOSwE25e9Xoc
"2019 Topps Allen and Ginter Non-Baseball Single Cards From Base Set #151-180 A&G", eBay, $1.00, Available, Unknown, https://www.ebay.com/itm/2019-Topps-Allen-and-Ginter-Non-Baseball-Single-Cards-From-Base-Set-151-180-A-G/153983617494?hash=item23da2389d6:g:eD8AAOSwnV9e9QyK
"Youth Kids STIO Size 10 Windbreaker Jacket blue and gray EUC", eBay, $25.00, Available, Unknown, https://www.ebay.com/itm/Youth-Kids-STIO-Size-10-Windbreaker-Jacket-blue-and-gray-EUC/153983560442?hash=item23da22aafa:g:FMYAAOSwJrBeXS~S
"Youth Kids STIO Size 12 Windbreaker Jacket navy and gray EUC", eBay, $25.00, Available, Unknown, https://www.ebay.com/itm/Youth-Kids-STIO-Size-12-Windbreaker-Jacket-navy-and-gray-EUC/153983560436?hash=item23da22aaf4:g:qsQAAOSwfZpeXTBj
"Stio Women’s Pinedale Pant Size 2 Elmwood Khaki Tan Hiking", eBay, $89.97 $116.97, Available, Unknown, https://www.ebay.com/itm/Stio-Women-s-Pinedale-Pant-Size-2-Elmwood-Khaki-Tan-Hiking/283927006022?hash=item421b5e4b46:g:3coAAOSwX2tea45C
"2019 Topps Allen & Ginter Autograph *** VINCENT STIO Mini Frame Auto MINT", eBay, $19.95, Available, Unknown, https://www.ebay.com/itm/2019-Topps-Allen-Ginter-Autograph-VINCENT-STIO-Mini-Frame-Auto-MINT/203031397195?hash=item2f459d434b:g:bjAAAOSwuHle9Mn0
"2019 Topps Allen & Ginter #156 Vincent Stio Umpire Fan Lot of 2", eBay, $2.25, Available, Unknown, https://www.ebay.com/itm/2019-Topps-Allen-Ginter-156-Vincent-Stio-Umpire-Fan-Lot-of-2/353118312156?hash=item52377dd6dc:g:W1EAAOSwfDle9C3y
"Stio Women Blue Long Sleeve Button-Down Shirt M", eBay, $28.99, Available, Unknown, https://www.ebay.com/itm/Stio-Women-Blue-Long-Sleeve-Button-Down-Shirt-M/293625971118?hash=item445d78c1ae:g:5dUAAOSwGnJe8-C3
"2019 Allen & Ginter RELIC Vincent Stio", eBay, $4.00, Available, Unknown, https://www.ebay.com/itm/2019-Allen-Ginter-RELIC-Vincent-Stio/254634415624?hash=item3b4964d608:g:W4YAAOSws4te88Sh
"Womens Stio Gray Shorts Sz 2 Flat Front Hiking Athleisure", eBay, $14.99, Available, Unknown, https://www.ebay.com/itm/Womens-Stio-Gray-Shorts-Sz-2-Flat-Front-Hiking-Athleisure/153982290009?hash=item23da0f4859:g:ceEAAOSwUBJdN8a~
"Stio Mens Hometown Down Hoodie jacket new with tags", eBay, $270.00, Available, Unknown, https://www.ebay.com/itm/Stio-Mens-Hometown-Down-Hoodie-jacket-new-with-tags/114273668165?hash=item1a9b3dcc45:g:vKwAAOSw22Zeh4GL
"Stio Stillwater Supply Co. Men's Rambler Reversible Gray Plaid Jacket Medium EUC", eBay, $52.89, Available, Medium, https://www.ebay.com/itm/Stio-Stillwater-Supply-Co-Mens-Rambler-Reversible-Gray-Plaid-Jacket-Medium-EUC/184339128188?hash=item2aeb77df7c:g:DwoAAOSw3npe8sJk
"Stio Ski Pants "Blue" Waterproof Breathable Fabric sz Medium NWT", eBay, $185.75, Available, Medium, https://www.ebay.com/itm/Stio-Ski-Pants-Blue-Waterproof-Breathable-Fabric-sz-Medium-NWT/264773446352?hash=item3da5ba2ad0:g:mYcAAOSwo8te8izw
"Black Underwire Bikini Stio Black size Large", eBay, $10.00, Available, Large, https://www.ebay.com/itm/Black-Underwire-Bikini-Stio-Black-size-Large/233627943890?hash=item36654f83d2:g:oz8AAOSwqHtelKrC
"Stio NWT Women's XS 1160 W's Hometown down coat Gray/Silver w/Blue lining", eBay, $144.00, Available, Xsmall, https://www.ebay.com/itm/Stio-NWT-Womens-XS-1160-Ws-Hometown-down-coat-Gray-Silver-w-Blue-lining/283924420177?hash=item421b36d651:g:S60AAOSw0NZeOy~1
"STIO “Rivet Stretch” Canvas Pants", eBay, $30.00, Available, Unknown, https://www.ebay.com/itm/STIO-Rivet-Stretch-Canvas-Pants/143638807439?hash=item21718a438f:g:FakAAOSwL0Je8fbE
"2019 Topps Allen & Ginter - Vincent Stio - Yankees Famous Umpire Fan", eBay, $2.10, Available, Unknown, https://www.ebay.com/itm/2019-Topps-Allen-Ginter-Vincent-Stio-Yankees-Famous-Umpire-Fan/153980846899?hash=item23d9f94333:g:ZZ8AAOSw6xZe5d14
"NEW Stio Trucker Hat Red Fishing Foam Flat Bill One Size", eBay, $20.00, Available, Unknown, https://www.ebay.com/itm/NEW-Stio-Trucker-Hat-Red-Fishing-Foam-Flat-Bill-One-Size/324206887432?hash=item4b7c3c8208:g:5TAAAOSw1dVekorY
"2019 Topps Allen & Ginter's Mini Non-Baseball Vincent Stio #MA-VS Rookie Auto", eBay, $17.79, Available, Unknown, https://www.ebay.com/itm/2019-Topps-Allen-Ginters-Mini-Non-Baseball-Vincent-Stio-MA-VS-Rookie-Auto/233626877825?hash=item36653f3f81:g:A9sAAOSwzMFe8K2B
"2019 Allen & Ginter Vincent Stio And Mike Oz RELIC (2) CARD LOT!", eBay, $9.99, Available, Unknown, https://www.ebay.com/itm/2019-Allen-Ginter-Vincent-Stio-And-Mike-Oz-RELIC-2-CARD-LOT/353114469243?hash=item523743337b:g:k5MAAOSwMMNe766Q
"Sick Flexi Soft FX03-XTIO 84002 + FX0-STIO 68002 (2 units) = TOTAL 3 UNITS", eBay, $120.00 $180.00, Available, Unknown, https://www.ebay.com/itm/Sick-Flexi-Soft-FX03-XTIO-84002-FX0-STIO-68002-2-units-TOTAL-3-UNITS/353114420868?hash=item5237427684:g:2~UAAOSwtYxeVCzB
"STIO jackson hole wyoming olive green 2040 1112 pants 32 x 27", eBay, $23.08, Available, Unknown, https://www.ebay.com/itm/STIO-jackson-hole-wyoming-olive-green-2040-1112-pants-32-x-27/324205115346?hash=item4b7c2177d2:g:hDcAAOSwel9eXE79
"2019 TOPPS ALLEN & GINTER SINGLES W/RC'S ***YOU PICK*** #'S 150 - 300", eBay, $0.99, Available, Unknown, https://www.ebay.com/itm/2019-TOPPS-ALLEN-GINTER-SINGLES-W-RCS-YOU-PICK-S-150-300/164251911588?hash=item263e2d45a4:g:u18AAOSw9KZe7AmE
"2019 Topps Allen and Ginter Assorted Mini (A5887) - You Pick - 10+ FREE SHIP", eBay, $1.99, Available, Unknown, https://www.ebay.com/itm/2019-Topps-Allen-and-Ginter-Assorted-Mini-A5887-You-Pick-10-FREE-SHIP/233622454434?hash=item3664fbc0a2:g:SrMAAOSwtzle6rND
"2019 Topps Allen and Ginter Card #s 1-250 (A5887) - You Pick - 10+ FREE SHIP", eBay, $0.99, Available, Unknown, https://www.ebay.com/itm/2019-Topps-Allen-and-Ginter-Card-s-1-250-A5887-You-Pick-10-FREE-SHIP/233622437554?hash=item3664fb7eb2:g:6xYAAOSwWVxe6q7y
"M'S NWT $399 STIO RAYMER HOODED JACKET SKI WINTER WATER/WIND PROOF LARGE 2415F19", eBay, $299.99, Available, Large, https://www.ebay.com/itm/MS-NWT-399-STIO-RAYMER-HOODED-JACKET-SKI-WINTER-WATER-WIND-PROOF-LARGE-2415F19/174320488022?hash=item28964f8e56:g:VmoAAOSw6JJe6q22
"STIO Beanie Hat w/Jackalope", eBay, $19.99, Available, Unknown, https://www.ebay.com/itm/STIO-Beanie-Hat-w-Jackalope/203023667127?hash=item2f45274fb7:g:-CMAAOSwFHteAFIx
"STIO WOMEN'S COTTON RED FLANNEL PLAID LONG SLEEVE BLOUSE  SIZE M", eBay, $35.00, Available, Unknown, https://www.ebay.com/itm/STIO-WOMENS-COTTON-RED-FLANNEL-PLAID-LONG-SLEEVE-BLOUSE-SIZE-M/264765763043?hash=item3da544ede3:g:ptAAAOSwjKNeb7Cf:sc:USPSFirstClass!94024!US!-1
"Stio Women Gray Long Sleeve Button-Down Shirt L", eBay, $25.99, Available, Unknown, https://www.ebay.com/itm/Stio-Women-Gray-Long-Sleeve-Button-Down-Shirt-L/293615372515?hash=item445cd708e3:g:r0MAAOSwuRpe6LsE
"1PC Window Background English Epidemic Prevention Propaganda Wall StiO_ES", eBay, $4.00, Available, Unknown, https://www.ebay.com/itm/1PC-Window-Background-English-Epidemic-Prevention-Propaganda-Wall-StiO-ES/233620904215?hash=item3664e41917:g:LXQAAOSwKWVejbJa
"Stio Women Pink 3/4 Sleeve Button-Down Shirt S", eBay, $26.99, Available, Unknown, https://www.ebay.com/itm/Stio-Women-Pink-3-4-Sleeve-Button-Down-Shirt-S/293614740680?hash=item445ccd64c8:g:lIUAAOSwCi5e6AXv
"Phoenix Contact Typ STIO-IN 2.5/3 Terminal Block 250V LOT OF 25", eBay, $54.59, Available, Unknown, https://www.ebay.com/itm/Phoenix-Contact-Typ-STIO-IN-2-5-3-Terminal-Block-250V-LOT-OF-25/303597150768?hash=item46afcce230:g:FFsAAOSwYE9e56l0:sc:USPSPriority!94024!US!-1
"Stio Women’s Pinedale Pant Size 6 Elmwood Khaki Tan Hiking", eBay, $99.97, Available, Unknown, https://www.ebay.com/itm/Stio-Women-s-Pinedale-Pant-Size-6-Elmwood-Khaki-Tan-Hiking/283915518029?hash=item421aaf004d:g:3coAAOSwX2tea45C
"120pcs Round Thank you Self-Adhesive sticker Paper Labels Seal StiO bf", eBay, $3.11, Available, Unknown, https://www.ebay.com/itm/120pcs-Round-Thank-you-Self-Adhesive-sticker-Paper-Labels-Seal-StiO-bf/373081894545?hash=item56dd69ee91:g:Q0cAAOSwEkJdY4wB
"100pcs/lot Chinese fu Round Seal sticker For handmade baking products stiO bf", eBay, $3.13, Available, Unknown, https://www.ebay.com/itm/100pcs-lot-Chinese-fu-Round-Seal-sticker-For-handmade-baking-products-stiO-bf/392835777251?hash=item5b76d642e3:g:52QAAOSwhLRd4M2F
"Stio Boys Blue Long Sleeve Button-Down Shirt 10", eBay, $23.99, Available, Unknown, https://www.ebay.com/itm/Stio-Boys-Blue-Long-Sleeve-Button-Down-Shirt-10/293610577225?hash=item445c8ddd49:g:ap4AAOSwmjZe4rgJ
"Stio Mens Medium Blue Plaid Short Sleeve Western Snap Down Shirt", eBay, $47.99, Available, Medium, https://www.ebay.com/itm/Stio-Mens-Medium-Blue-Plaid-Short-Sleeve-Western-Snap-Down-Shirt/203018738546?hash=item2f44dc1b72:g:ctMAAOSwvchdrH1k
"Phoenix Contact Typ STIO-IN 2.5/3 Terminal Block 250V LOT OF 23", eBay, $50.39, Available, Unknown, https://www.ebay.com/itm/Phoenix-Contact-Typ-STIO-IN-2-5-3-Terminal-Block-250V-LOT-OF-23/293610131160?hash=item445c870ed8:g:DrMAAOSwevRe4kmc:sc:USPSPriority!94024!US!-1
"Stio NWT Mens Shorts Gray Size 30", eBay, $39.95, Available, Unknown, https://www.ebay.com/itm/Stio-NWT-Mens-Shorts-Gray-Size-30/264760610681?hash=item3da4f64f79:g:Rv0AAOSwSTFe4kR8
"Stio Women Black Short Sleeve T-Shirt XL", eBay, $50.99, Available, XLarge, https://www.ebay.com/itm/Stio-Women-Black-Short-Sleeve-T-Shirt-XL/124219654008?hash=item1cec117f78:g:cWAAAOSwXf9e4hRv
"2019 Topps Allen & Ginter X Vincent Stio #156 Umpire Fan", eBay, $0.99, Available, Unknown, https://www.ebay.com/itm/2019-Topps-Allen-Ginter-X-Vincent-Stio-156-Umpire-Fan/373079216458?hash=item56dd41114a:g:OFkAAOSwh9Je4EuN
"STIO Men's Coburn Pants Blue Mirage Stretchy Nylon Hiking Camping Size 36x31", eBay, $52.00, Available, Unknown, https://www.ebay.com/itm/STIO-Mens-Coburn-Pants-Blue-Mirage-Stretchy-Nylon-Hiking-Camping-Size-36x31/283907420512?hash=item421a337160:g:4mEAAOSwNZNe3E2k
"Men's Stio 2107 Gannet Peak Lounge Pant  Size M - Evergreen", eBay, $118.00, Available, Unknown, https://www.ebay.com/itm/Mens-Stio-2107-Gannet-Peak-Lounge-Pant-Size-M-Evergreen/264757414121?hash=item3da4c588e9:g:Yl4AAOSw3e1e3l8c:sc:USPSFirstClass!94024!US!-1
"Stio Divide DriRelease Navy Blue Casual Tech Polo Shirt Mens Large", eBay, $23.99, Available, Large, https://www.ebay.com/itm/Stio-Divide-DriRelease-Navy-Blue-Casual-Tech-Polo-Shirt-Mens-Large/392829246306?hash=item5b76729b62:g:za0AAOSwklZe3OOC
"VINCENT STIO 2019 Allen & Ginter GOLD BORDER Hot Box - UMPIRE FAN - #156", eBay, $1.00, Available, Unknown, https://www.ebay.com/itm/VINCENT-STIO-2019-Allen-Ginter-GOLD-BORDER-Hot-Box-UMPIRE-FAN-156/303588525869?hash=item46af49472d:g:l14AAOSwul1e2u~V
"NWT Stio Women's Medium 1396 Poplar Mountain Iris Plaid Shirt", eBay, $48.87, Available, Medium, https://www.ebay.com/itm/NWT-Stio-Womens-Medium-1396-Poplar-Mountain-Iris-Plaid-Shirt/133429971901?hash=item1f110bcbbd:g:eZUAAOSwOkle2akM
"Stio Women's Medium Long Sleeve Blue Plaid Flannel Shirt", eBay, $46.47, Available, Medium, https://www.ebay.com/itm/Stio-Womens-Medium-Long-Sleeve-Blue-Plaid-Flannel-Shirt/133429216448?hash=item1f110044c0:g:PeIAAOSwaspe2HRs
"Stio Size MEDIUM Mens Gray Lined Swim / Running Shorts + FAST SHIPPING!!!", eBay, $39.99, Available, Medium, https://www.ebay.com/itm/Stio-Size-MEDIUM-Mens-Gray-Lined-Swim-Running-Shorts-FAST-SHIPPING/174305661039?hash=item28956d506f:g:Un4AAOSwE25e2AvC
"STIO Men's Raymer Jacket Caldera Red sz MEDIUM NWT", eBay, $178.80, Available, Medium, https://www.ebay.com/itm/STIO-Mens-Raymer-Jacket-Caldera-Red-sz-MEDIUM-NWT/264752684010?hash=item3da47d5bea:g:-zwAAOSwmjZe1~1z
"Stio Womens Harkin Snap Shirt Sz Small Green Teal Floral Long Sleeve", eBay, $23.99, Available, Small, https://www.ebay.com/itm/Stio-Womens-Harkin-Snap-Shirt-Sz-Small-Green-Teal-Floral-Long-Sleeve/274386599264?hash=item3fe2b73d60:g:z2oAAOSw5ERe1-Sr
"Stio Fleece Hoodie Jacket Gray Mens Medium Zip", eBay, $69.99, Available, Medium, https://www.ebay.com/itm/Stio-Fleece-Hoodie-Jacket-Gray-Mens-Medium-Zip/114247280247?hash=item1a99ab2677:g:IhgAAOSw0oFe19f~
"Stio women’s Modis Trench Coat", eBay, $125.99, Available, Unknown, https://www.ebay.com/itm/Stio-women-s-Modis-Trench-Coat/274386514783?hash=item3fe2b5f35f:g:BD0AAOSwrkJe18na
"Supermicro X8STI Intel LGA1366 ATX Server Motherboard", eBay, $59.99, Available, Unknown, https://www.ebay.com/itm/Supermicro-X8STI-Intel-LGA1366-ATX-Server-Motherboard/174303256822?epid=80298201&hash=item289548a0f6:g:HP8AAOSwevRe1U-c
"Stio Boys Red Long Sleeve Button-Down Shirt 12", eBay, $25.99, Available, Unknown, https://www.ebay.com/itm/Stio-Boys-Red-Long-Sleeve-Button-Down-Shirt-12/303584207097?hash=item46af0760f9:g:w9gAAOSwaKRe1PN6
"STIO Mens Gray/Blue Soft Shell Blazer Size 38", eBay, $49.99, Available, Unknown, https://www.ebay.com/itm/STIO-Mens-Gray-Blue-Soft-Shell-Blazer-Size-38/274380436948?hash=item3fe25935d4:g:iaUAAOSw0oBe0Ci6
"STIO Mens Tan Soft Shell BLazer Size 38", eBay, $49.99, Available, Unknown, https://www.ebay.com/itm/STIO-Mens-Tan-Soft-Shell-BLazer-Size-38/274380402812?hash=item3fe258b07c:g:e3wAAOSwrkJe0B2j
"Stio Women's Hometown Long Sleeve Hooded Down Parka SC4 Castlerock Large NWT", eBay, $199.99, Available, Large, https://www.ebay.com/itm/Stio-Womens-Hometown-Long-Sleeve-Hooded-Down-Parka-SC4-Castlerock-Large-NWT/303580922640?hash=item46aed54310:g:3YcAAOSwVhNe0BCD
"Stio Celestial Downwater Board Shorts Mens 2058 Guster Sz 33 Swim Trunks Suit", eBay, $39.99, Available, Unknown, https://www.ebay.com/itm/Stio-Celestial-Downwater-Board-Shorts-Mens-2058-Guster-Sz-33-Swim-Trunks-Suit/114238221054?hash=item1a9920eafe:g:gD8AAOSwuOdezfDE
"2019 Topps Allen & Ginter Baseball Gold Hot Box - Pick A Player - Cards 1-200", eBay, $1.79, Available, Unknown, https://www.ebay.com/itm/2019-Topps-Allen-Ginter-Baseball-Gold-Hot-Box-Pick-A-Player-Cards-1-200/143614159767?hash=item2170122b97:g:wc4AAOSwBAFeyyQD
"$1.00 Women's & Men's Fashion Catalog - STIO Summer 2020 - 52 Pages", eBay, $1.00, Available, Unknown, https://www.ebay.com/itm/1-00-Womens-Mens-Fashion-Catalog-STIO-Summer-2020-52-Pages/224021606912?hash=item3428ba7200:g:7k8AAOSwyw1eymwe
"Stio Lone Tree Men's Shirt X-Large Quiet Grey Plaid NWT", eBay, $79.99, Available, Large, https://www.ebay.com/itm/Stio-Lone-Tree-Mens-Shirt-X-Large-Quiet-Grey-Plaid-NWT/254606312924?hash=item3b47b805dc:g:f8AAAOSwUQleyaiU
"Pair Front CV Joint Axle Assembly Fit Saturn Ion Standard Trans M86 2.0L 05-07", eBay, $101.51, Available, XLarge, https://www.ebay.com/itm/Pair-Front-CV-Joint-Axle-Assembly-Fit-Saturn-Ion-Standard-Trans-M86-2-0L-05-07/324173656096?epid=2215632984&hash=item4b7a417020:g:MVUAAOSwqBtexzld
"Men’s Stio Alpiner Hooded Jacket XXL black POLARTEC Alpha", eBay, $125.00, Available, XLarge, https://www.ebay.com/itm/Men-s-Stio-Alpiner-Hooded-Jacket-XXL-black-POLARTEC-Alpha/153942072090?hash=item23d7a99b1a:g:Oj0AAOSwgRZexws2
"New Stio Womens XL Environ Yellow Snow Pants $389", eBay, $169.95, Available, XLarge, https://www.ebay.com/itm/New-Stio-Womens-XL-Environ-Yellow-Snow-Pants-389/202997799823?hash=item2f439c9b8f:g:eX4AAOSwJ65exp8G
"2019 Allen & Ginter Mini - You Pick - #1-200 - Post Malone", eBay, $1.49, Available, Unknown, https://www.ebay.com/itm/2019-Allen-Ginter-Mini-You-Pick-1-200-Post-Malone/402269070202?hash=item5da91ae37a:g:5CIAAOSwmjZexbq9
"Stio Kids Winter Insulated Jacket Size 8", eBay, $139.99, Available, Unknown, https://www.ebay.com/itm/Stio-Kids-Winter-Insulated-Jacket-Size-8/333599645372?hash=item4dac169ebc:g:iCYAAOSwXSVevtse
"Stio Mens XL Rain Shell - Blue", eBay, $100.00, Available, XLarge, https://www.ebay.com/itm/Stio-Mens-XL-Rain-Shell-Blue/274366117903?hash=item3fe17eb80f:g:ga8AAOSwIrtevbdW
"STIO Women's Pants Coburn Jogger Gray Stretch Size 10 Z7", eBay, $42.25, Available, Unknown, https://www.ebay.com/itm/STIO-Womens-Pants-Coburn-Jogger-Gray-Stretch-Size-10-Z7/153932284203?hash=item23d714412b:g:TOgAAOSwhelescCO
"Stio Mens XL Snap Button Skiier Print Green Western Polyester Long Sleeve Shirt", eBay, $39.95, Available, XLarge, https://www.ebay.com/itm/Stio-Mens-XL-Snap-Button-Skiier-Print-Green-Western-Polyester-Long-Sleeve-Shirt/133410488337?hash=item1f0fe28011:g:JC8AAOSwNuBevOya
"STIO CFS Board Pants Lightweight Outdoor Hiking Climbing Men's Size 34 EUC", eBay, $89.99, Available, Unknown, https://www.ebay.com/itm/STIO-CFS-Board-Pants-Lightweight-Outdoor-Hiking-Climbing-Mens-Size-34-EUC/293578235273?hash=item445aa05d89:g:15MAAOSw9CNeu0ye
"2019 Topps Allen & Ginter MINI Cards ~ Pick your card", eBay, $0.99, Available, Unknown, https://www.ebay.com/itm/2019-Topps-Allen-Ginter-MINI-Cards-Pick-your-card/324164487688?hash=item4b79b58a08:g:cGkAAOSwx5le4YO5
"2019 Topps Allen & Ginter BASE Cards (1-200) ~ Pick your card", eBay, $0.99, Available, Unknown, https://www.ebay.com/itm/2019-Topps-Allen-Ginter-BASE-Cards-1-200-Pick-your-card/324163510712?hash=item4b79a6a1b8:g:IUAAAOSwzFFe4YNc
"2019 Topps Allen and Ginter X #156 Vincent Stio - NM-MT", eBay, $0.99, Available, Unknown, https://www.ebay.com/itm/2019-Topps-Allen-and-Ginter-X-156-Vincent-Stio-NM-MT/313079899814?hash=item48e50426a6:g:2EEAAOSwuMVeudD3
"2019 Topps Allen and Ginter Mini A and G Back #156 Vincent Stio", eBay, $1.80, Available, Unknown, https://www.ebay.com/itm/2019-Topps-Allen-and-Ginter-Mini-A-and-G-Back-156-Vincent-Stio/313079899389?hash=item48e50424fd:g:ZdUAAOSwOape9Kg4
"2019 Topps Allen and Ginter Mini #156 Vincent Stio", eBay, $1.35, Available, Unknown, https://www.ebay.com/itm/2019-Topps-Allen-and-Ginter-Mini-156-Vincent-Stio/164195125677?hash=item263acac9ad:g:zRYAAOSwj-Ze9KOH
"2019 Topps Allen and Ginter Gold Border #156 Vincent Stio", eBay, $2.25, Available, Unknown, https://www.ebay.com/itm/2019-Topps-Allen-and-Ginter-Gold-Border-156-Vincent-Stio/362992201269?hash=item5484056e35:g:sbMAAOSwz7Ve9J7L
"2019 Topps Allen and Ginter #156 Vincent Stio", eBay, $0.99, Available, Unknown, https://www.ebay.com/itm/2019-Topps-Allen-and-Ginter-156-Vincent-Stio/164195125585?hash=item263acac951:g:34oAAOSwDFxeudDk
"SICK Flexi soft Standard I/O Module FX0-STIO68002 F/W: V3.00.0 24VDC 1.5W Used", eBay, $225.00, Available, Unknown, https://www.ebay.com/itm/SICK-Flexi-soft-Standard-I-O-Module-FX0-STIO68002-F-W-V3-00-0-24VDC-1-5W-Used/293573459689?epid=11036033459&hash=item445a577ee9:g:nB0AAOSw709etWio
"Stio Pants Womens Dulcet Nylon Zip Ankle Skinny Army Green Sz 10 Jackson Hole", eBay, $45.99, Available, Unknown, https://www.ebay.com/itm/Stio-Pants-Womens-Dulcet-Nylon-Zip-Ankle-Skinny-Army-Green-Sz-10-Jackson-Hole/333593481806?hash=item4dabb8924e:g:0UsAAOSwtO5dc6Nl
"Falansterulcpv3204(Adrian Pintea  Liviu Ciulei  Mihai Malaimare  dir. Savel Stio", eBay, $43.02, Available, Unknown, https://www.ebay.com/itm/Falansterulcpv3204-Adrian-Pintea-Liviu-Ciulei-Mihai-Malaimare-dir-Savel-Stio/233580427528?hash=item36627a7908:g:ZccAAOSwWNResmpi
"Stio Wilcox fleece hoodie  Men's Medium  Maritime Blue  NWT", eBay, $130.00, Available, Medium, https://www.ebay.com/itm/Stio-Wilcox-fleece-hoodie-Mens-Medium-Maritime-Blue-NWT/362987224767?hash=item5483b97ebf:g:noMAAOSwf1ResZtv
"Stio Women's Tailored-Fit OPR Shorts MC7 Boundary Black Size 8 NWT $139", eBay, $67.49, Available, Unknown, https://www.ebay.com/itm/Stio-Womens-Tailored-Fit-OPR-Shorts-MC7-Boundary-Black-Size-8-NWT-139/303559741511?hash=item46ad921047:g:~bcAAOSwfOlesVrS
"EUC Stio Divide v neck purple women's size small", eBay, $26.00, Available, Small, https://www.ebay.com/itm/EUC-Stio-Divide-v-neck-purple-womens-size-small/254588521255?hash=item3b46a88b27:g:17MAAOSwJkJesVjZ
"1963 Press Photo Michael Stio  4  wrthes in pain when the car hit him in", eBay, $19.99, Available, Unknown, https://www.ebay.com/itm/1963-Press-Photo-Michael-Stio-4-wrthes-in-pain-when-the-car-hit-him-in/353068505942?hash=item523485db56:g:0TcAAOSwIL9esGBU
"2019 Topps Allen and Ginter Baseball Singles***YOU PICK FROM LIST***", eBay, $1.85, Available, Unknown, https://www.ebay.com/itm/2019-Topps-Allen-and-Ginter-Baseball-Singles-YOU-PICK-FROM-LIST/202982354519?hash=item2f42b0ee57:g:jUMAAOSw8Jxerwp8
"Stio Fleece Jacket Blue Mens Sz XL EUC", eBay, $49.99, Available, XLarge, https://www.ebay.com/itm/Stio-Fleece-Jacket-Blue-Mens-Sz-XL-EUC/114210148457?hash=item1a97749069:g:VJUAAOSwRTJerf9q
"Falansterulcpv3204(Adrian Pintea  Liviu Ciulei  Mihai Malaimare  dir. Savel Stio", eBay, $42.00, Available, Unknown, https://www.ebay.com/itm/Falansterulcpv3204-Adrian-Pintea-Liviu-Ciulei-Mihai-Malaimare-dir-Savel-Stio/143594483206?hash=item216ee5ee06:g:n8oAAOSwOPVerR60
"Super Micro Computer X8STi  LGA 1366/Socket B  Intel Motherboard", eBay, $154.99, Available, Unknown, https://www.ebay.com/itm/Super-Micro-Computer-X8STi-LGA-1366-Socket-B-Intel-Motherboard/264717961345?epid=80298201&hash=item3da26b8881:g:wfMAAOSwxkderJO6
"STIO 1150 WOMENS ENVIRON JACKET *BLUE/PINK* SZ XL", eBay, $195.04, Available, XLarge, https://www.ebay.com/itm/STIO-1150-WOMENS-ENVIRON-JACKET-BLUE-PINK-SZ-XL/264717635164?hash=item3da2668e5c:g:R9UAAOSwe9terDq0
"Stio Women's Snap Button Ralston Canvas Jacket KB8 Brush Green XL NWT $159", eBay, $103.49, Available, XLarge, https://www.ebay.com/itm/Stio-Womens-Snap-Button-Ralston-Canvas-Jacket-KB8-Brush-Green-XL-NWT-159/373038746671?hash=item56dad78c2f:g:iJoAAOSw7RJerBtf
"Stio Sweetwater Polar Fleece XS Full Zip Jacket Purple NWOT", eBay, $48.99, Available, Xsmall, https://www.ebay.com/itm/Stio-Sweetwater-Polar-Fleece-XS-Full-Zip-Jacket-Purple-NWOT/114207107345?hash=item1a97462911:g:KzEAAOSw-9leqxK-
"2019 Allen & Ginter MINI GOLD BORDER - COMPLETE YOUR SET - You Pick! Hot Box!", eBay, $5.99, Available, Unknown, https://www.ebay.com/itm/2019-Allen-Ginter-MINI-GOLD-BORDER-COMPLETE-YOUR-SET-You-Pick-Hot-Box/402247593301?hash=item5da7d32d55:g:dD4AAOSw9h5eqPC8
